order_id,order_date,order_time,crop_type,state,season,quantity_quintals,price_per_quintal_inr,total_value_inr,quality_grade,buyer_type,buyer_id,status,payment_status,created_timestamp
ORD-00000001,18-12-2023,56:17.3,soybean,Maharashtra,rabi,254.87,4072.64,1037990.01,C,trader,BUYER-00072,completed,paid,2023-12-18T10:56:17.336399
ORD-00000002,18-12-2023,56:17.3,groundnut,Odisha,rabi,488.68,4663.39,2278888.03,A,processor,BUYER-00467,pending,pending,2023-12-18T10:56:17.336399
ORD-00000003,18-12-2023,56:17.3,soybean,Maharashtra,rabi,88.91,4444.99,395201.19,A,retailer,BUYER-00373,completed,partial,2023-12-18T10:56:17.336399
ORD-00000004,18-12-2023,56:17.3,sesame,Maharashtra,rabi,299.99,6905.74,2071650.93,C,retailer,BUYER-00662,pending,partial,2023-12-18T10:56:17.336399
ORD-00000005,19-12-2023,56:17.3,sesame,Gujarat,rabi,656.72,7148.26,4694409.06,A,exporter,BUYER-00806,pending,pending,2023-12-19T10:56:17.336399
ORD-00000006,19-12-2023,56:17.3,soybean,Rajasthan,rabi,26.59,5164.49,137298.03,C,exporter,BUYER-00161,delivered,pending,2023-12-19T10:56:17.336399
ORD-00000007,20-12-2023,56:17.3,groundnut,Karnataka,rabi,429.21,5093.83,2186327.6,B,processor,BUYER-00561,completed,pending,2023-12-20T10:56:17.336399
ORD-00000008,20-12-2023,56:17.3,soybean,Telangana,rabi,154.52,4364.81,674451.86,B,trader,BUYER-00476,completed,partial,2023-12-20T10:56:17.336399
ORD-00000009,20-12-2023,56:17.3,mustard,Haryana,rabi,984.19,4415.19,4345391.01,A,exporter,BUYER-00958,completed,partial,2023-12-20T10:56:17.336399
ORD-00000010,21-12-2023,56:17.3,sunflower,Bihar,rabi,273.12,3666.01,1001273.39,C,trader,BUYER-00244,pending,paid,2023-12-21T10:56:17.336399
ORD-00000011,21-12-2023,56:17.3,soybean,Maharashtra,rabi,197.55,3887.71,768016.77,C,retailer,BUYER-00819,delivered,paid,2023-12-21T10:56:17.336399
ORD-00000012,21-12-2023,56:17.3,groundnut,Madhya Pradesh,rabi,641.05,5122.78,3283952.79,B,trader,BUYER-00274,delivered,partial,2023-12-21T10:56:17.336399
ORD-00000013,21-12-2023,56:17.3,sunflower,Rajasthan,rabi,682.11,4330.82,2954086.64,B,trader,BUYER-00242,completed,partial,2023-12-21T10:56:17.336399
ORD-00000014,22-12-2023,56:17.3,sunflower,Odisha,rabi,165.38,3341.35,552576.32,C,processor,BUYER-00340,pending,partial,2023-12-22T10:56:17.336399
ORD-00000015,22-12-2023,56:17.3,groundnut,Haryana,rabi,199.66,5485.89,1095320.91,C,retailer,BUYER-00428,completed,pending,2023-12-22T10:56:17.336399
ORD-00000016,22-12-2023,56:17.3,mustard,Andhra Pradesh,rabi,331.76,4129.52,1370012.7,C,retailer,BUYER-00206,pending,pending,2023-12-22T10:56:17.336399
ORD-00000017,23-12-2023,56:17.3,soybean,Karnataka,rabi,119.84,4719.41,565595.75,A,trader,BUYER-00002,delivered,pending,2023-12-23T10:56:17.336399
ORD-00000018,23-12-2023,56:17.3,soybean,Karnataka,rabi,115.83,4105.72,475580.76,C,trader,BUYER-00772,completed,partial,2023-12-23T10:56:17.336399
ORD-00000019,24-12-2023,56:17.3,mustard,Gujarat,rabi,102.55,5292.89,542762.43,C,exporter,BUYER-00556,completed,pending,2023-12-24T10:56:17.336399
ORD-00000020,24-12-2023,56:17.3,groundnut,Karnataka,rabi,567.33,5815.93,3299548.62,C,trader,BUYER-00270,pending,partial,2023-12-24T10:56:17.336399
ORD-00000021,24-12-2023,56:17.3,mustard,Punjab,rabi,664,4550.22,3021342.59,B,trader,BUYER-00462,completed,paid,2023-12-24T10:56:17.336399
ORD-00000022,25-12-2023,56:17.3,sesame,Uttar Pradesh,rabi,353.19,7399.29,2613385.21,A,processor,BUYER-00725,completed,paid,2023-12-25T10:56:17.336399
ORD-00000023,25-12-2023,56:17.3,groundnut,Bihar,rabi,269.89,4843.3,1307138.8,B,processor,BUYER-00053,delivered,pending,2023-12-25T10:56:17.336399
ORD-00000024,25-12-2023,56:17.3,sesame,Uttar Pradesh,rabi,260.02,7407.25,1926058.4,C,trader,BUYER-00188,pending,paid,2023-12-25T10:56:17.336399
ORD-00000025,25-12-2023,56:17.3,soybean,Bihar,rabi,112.98,4015.25,453634.19,C,trader,BUYER-00015,pending,pending,2023-12-25T10:56:17.336399
ORD-00000026,26-12-2023,56:17.3,soybean,Andhra Pradesh,rabi,47.62,5157.3,245602.05,B,retailer,BUYER-00344,delivered,paid,2023-12-26T10:56:17.336399
ORD-00000027,26-12-2023,56:17.3,sunflower,Haryana,rabi,372.97,3564.58,1329470.01,A,processor,BUYER-00063,pending,pending,2023-12-26T10:56:17.336399
ORD-00000028,27-12-2023,56:17.3,sesame,Punjab,rabi,165.7,6912.12,1145345.7,A,retailer,BUYER-00419,delivered,paid,2023-12-27T10:56:17.336399
ORD-00000029,27-12-2023,56:17.3,sesame,Haryana,rabi,450.28,5669.39,2552807.4,A,trader,BUYER-00231,delivered,paid,2023-12-27T10:56:17.336399
ORD-00000030,27-12-2023,56:17.3,soybean,Telangana,rabi,185.21,5060.2,937207.51,B,retailer,BUYER-00201,completed,paid,2023-12-27T10:56:17.336399
ORD-00000031,27-12-2023,56:17.3,sesame,Madhya Pradesh,rabi,428.31,6170.25,2642764.64,A,exporter,BUYER-00048,completed,partial,2023-12-27T10:56:17.336399
ORD-00000032,28-12-2023,56:17.3,groundnut,Rajasthan,rabi,250.72,4927.29,1235386.38,C,exporter,BUYER-00099,pending,paid,2023-12-28T10:56:17.336399
ORD-00000033,28-12-2023,56:17.3,sunflower,Haryana,rabi,345.16,3543.18,1222978.22,C,exporter,BUYER-00547,completed,partial,2023-12-28T10:56:17.336399
ORD-00000034,28-12-2023,56:17.3,groundnut,Odisha,rabi,334.68,4606.57,1541741.11,B,exporter,BUYER-00462,pending,partial,2023-12-28T10:56:17.336399
ORD-00000035,28-12-2023,56:17.3,sunflower,Uttar Pradesh,rabi,516.69,4052.77,2094008.03,C,exporter,BUYER-00503,completed,paid,2023-12-28T10:56:17.336399
ORD-00000036,29-12-2023,56:17.3,groundnut,Madhya Pradesh,rabi,297.42,4483.08,1333335.7,B,processor,BUYER-00207,pending,partial,2023-12-29T10:56:17.336399
ORD-00000037,29-12-2023,56:17.3,groundnut,Punjab,rabi,479.94,4459.65,2140362.01,A,processor,BUYER-00461,completed,partial,2023-12-29T10:56:17.336399
ORD-00000038,29-12-2023,56:17.3,soybean,Karnataka,rabi,101.36,5034.28,510259.71,A,processor,BUYER-00241,delivered,paid,2023-12-29T10:56:17.336399
ORD-00000039,29-12-2023,56:17.3,sesame,Karnataka,rabi,172.31,6516.71,1122921.98,B,exporter,BUYER-00734,completed,partial,2023-12-29T10:56:17.336399
ORD-00000040,30-12-2023,56:17.3,groundnut,Odisha,rabi,165.43,5060.2,837083.82,C,exporter,BUYER-00171,completed,pending,2023-12-30T10:56:17.336399
ORD-00000041,30-12-2023,56:17.3,mustard,Karnataka,rabi,271.44,5437.71,1476038.4,A,processor,BUYER-00839,pending,pending,2023-12-30T10:56:17.336399
ORD-00000042,31-12-2023,56:17.3,sunflower,Gujarat,rabi,589.31,4233.73,2494987.67,B,exporter,BUYER-00682,pending,paid,2023-12-31T10:56:17.336399
ORD-00000043,31-12-2023,56:17.3,soybean,Maharashtra,rabi,322.65,4680.1,1510033.86,B,trader,BUYER-00646,completed,paid,2023-12-31T10:56:17.336399
ORD-00000044,31-12-2023,56:17.3,groundnut,Karnataka,rabi,306.53,4760.77,1459311.59,C,exporter,BUYER-00340,completed,pending,2023-12-31T10:56:17.336399
ORD-00000045,31-12-2023,56:17.3,groundnut,Andhra Pradesh,rabi,643.6,5261.37,3386238.43,B,retailer,BUYER-00506,completed,pending,2023-12-31T10:56:17.336399
ORD-00000046,01-01-2024,56:17.3,sesame,Madhya Pradesh,rabi,587.4,6145.11,3609638.46,A,processor,BUYER-00225,completed,paid,2024-01-01T10:56:17.336399
ORD-00000047,01-01-2024,56:17.3,groundnut,Gujarat,rabi,323.36,5430.4,1755981.65,B,exporter,BUYER-00633,completed,pending,2024-01-01T10:56:17.336399
ORD-00000048,01-01-2024,56:17.3,soybean,Rajasthan,rabi,275.95,4986.99,1376160.79,B,processor,BUYER-00359,delivered,pending,2024-01-01T10:56:17.336399
ORD-00000049,01-01-2024,56:17.3,mustard,Andhra Pradesh,rabi,188.62,4849.09,914657.45,B,exporter,BUYER-00318,completed,paid,2024-01-01T10:56:17.336399
ORD-00000050,02-01-2024,56:17.3,sunflower,Karnataka,rabi,564.09,3537.13,1995260.03,A,processor,BUYER-00664,pending,pending,2024-01-02T10:56:17.336399
ORD-00000051,02-01-2024,56:17.3,soybean,Maharashtra,rabi,295.97,4261.32,1261219.98,C,exporter,BUYER-00608,pending,partial,2024-01-02T10:56:17.336399
ORD-00000052,03-01-2024,56:17.3,groundnut,Maharashtra,rabi,361.49,4521.23,1634393.65,C,processor,BUYER-00442,completed,paid,2024-01-03T10:56:17.336399
ORD-00000053,03-01-2024,56:17.3,sesame,Madhya Pradesh,rabi,417.4,6015.98,2511065.21,C,retailer,BUYER-00386,delivered,paid,2024-01-03T10:56:17.336399
ORD-00000054,04-01-2024,56:17.3,sesame,Karnataka,rabi,133.48,6080.44,811644.8,C,processor,BUYER-00081,pending,paid,2024-01-04T10:56:17.336399
ORD-00000055,04-01-2024,56:17.3,mustard,Bihar,rabi,174.13,5486.33,955348.63,C,trader,BUYER-00220,delivered,paid,2024-01-04T10:56:17.336399
ORD-00000056,04-01-2024,56:17.3,sunflower,Karnataka,rabi,95.12,3547.66,337435.64,B,exporter,BUYER-00225,completed,partial,2024-01-04T10:56:17.336399
ORD-00000057,04-01-2024,56:17.3,sunflower,Uttar Pradesh,rabi,501.51,4006,2009050.64,B,processor,BUYER-00053,completed,pending,2024-01-04T10:56:17.336399
ORD-00000058,05-01-2024,56:17.3,sesame,Punjab,rabi,586.33,5997.01,3516217.97,A,processor,BUYER-00836,pending,paid,2024-01-05T10:56:17.336399
ORD-00000059,05-01-2024,56:17.3,sesame,Andhra Pradesh,rabi,88.63,6245.83,553567.46,A,trader,BUYER-00401,completed,paid,2024-01-05T10:56:17.336399
ORD-00000060,05-01-2024,56:17.3,sunflower,Andhra Pradesh,rabi,559.75,3649.27,2042671.25,A,exporter,BUYER-00884,pending,partial,2024-01-05T10:56:17.336399
ORD-00000061,06-01-2024,56:17.3,sunflower,Punjab,rabi,383.34,3840.78,1472330.01,C,processor,BUYER-00752,pending,partial,2024-01-06T10:56:17.336399
ORD-00000062,06-01-2024,56:17.3,sunflower,Bihar,rabi,510.75,3401.82,1737480.66,A,retailer,BUYER-00187,delivered,paid,2024-01-06T10:56:17.336399
ORD-00000063,06-01-2024,56:17.3,soybean,Odisha,rabi,54.64,3880.05,212024.36,C,retailer,BUYER-00660,delivered,pending,2024-01-06T10:56:17.336399
ORD-00000064,07-01-2024,56:17.3,sesame,Karnataka,rabi,107.36,6911.74,742031.44,C,trader,BUYER-00511,completed,partial,2024-01-07T10:56:17.336399
ORD-00000065,07-01-2024,56:17.3,sunflower,Haryana,rabi,207.38,3965.5,822345.06,B,trader,BUYER-00820,completed,paid,2024-01-07T10:56:17.336399
ORD-00000066,07-01-2024,56:17.3,mustard,Andhra Pradesh,rabi,863.18,4652.5,4015955.11,A,processor,BUYER-00551,delivered,paid,2024-01-07T10:56:17.336399
ORD-00000067,07-01-2024,56:17.3,sunflower,Rajasthan,rabi,539.43,3386.77,1826922.68,C,exporter,BUYER-00988,pending,partial,2024-01-07T10:56:17.336399
ORD-00000068,08-01-2024,56:17.3,mustard,Haryana,rabi,203.74,5411.56,1102568.19,A,processor,BUYER-00990,completed,partial,2024-01-08T10:56:17.336399
ORD-00000069,08-01-2024,56:17.3,groundnut,Haryana,rabi,686.26,4776.54,3277969.11,A,trader,BUYER-00144,pending,partial,2024-01-08T10:56:17.336399
ORD-00000070,09-01-2024,56:17.3,groundnut,Gujarat,rabi,1106.95,5225.95,5784843.77,A,processor,BUYER-00881,delivered,pending,2024-01-09T10:56:17.336399
ORD-00000071,09-01-2024,56:17.3,soybean,Telangana,rabi,102.92,3950.69,406621.19,A,retailer,BUYER-00652,pending,paid,2024-01-09T10:56:17.336399
ORD-00000072,09-01-2024,56:17.3,sunflower,Haryana,rabi,411.18,4236.21,1741850.38,B,retailer,BUYER-00009,completed,paid,2024-01-09T10:56:17.336399
ORD-00000073,10-01-2024,56:17.3,groundnut,Gujarat,rabi,466.07,5552.49,2587875.48,A,retailer,BUYER-00131,pending,pending,2024-01-10T10:56:17.336399
ORD-00000074,10-01-2024,56:17.3,mustard,Bihar,rabi,445.79,4662.49,2078511.92,C,retailer,BUYER-00673,delivered,paid,2024-01-10T10:56:17.336399
ORD-00000075,11-01-2024,56:17.3,soybean,Gujarat,rabi,423.93,4885.21,2070997.64,A,exporter,BUYER-00104,completed,paid,2024-01-11T10:56:17.336399
ORD-00000076,11-01-2024,56:17.3,mustard,Telangana,rabi,464.97,4093.24,1903219.3,B,retailer,BUYER-00510,completed,paid,2024-01-11T10:56:17.336399
ORD-00000077,11-01-2024,56:17.3,groundnut,Gujarat,rabi,886.99,5938.92,5267744.43,B,trader,BUYER-00914,completed,pending,2024-01-11T10:56:17.336399
ORD-00000078,11-01-2024,56:17.3,sunflower,Bihar,rabi,101.81,3855.56,392520.85,C,exporter,BUYER-00822,pending,partial,2024-01-11T10:56:17.336399
ORD-00000079,12-01-2024,56:17.3,sunflower,Maharashtra,rabi,696.38,3485.67,2427348.26,A,trader,BUYER-00161,completed,partial,2024-01-12T10:56:17.336399
ORD-00000080,12-01-2024,56:17.3,sunflower,Maharashtra,rabi,117.9,3793.04,447182.5,A,exporter,BUYER-00816,delivered,partial,2024-01-12T10:56:17.336399
ORD-00000081,12-01-2024,56:17.3,sunflower,Gujarat,rabi,501.7,3970.58,1992030.7,C,processor,BUYER-00135,delivered,partial,2024-01-12T10:56:17.336399
ORD-00000082,12-01-2024,56:17.3,groundnut,Andhra Pradesh,rabi,640.26,4900.57,3137658.08,A,exporter,BUYER-00688,completed,partial,2024-01-12T10:56:17.336399
ORD-00000083,13-01-2024,56:17.3,sesame,Bihar,rabi,124.11,6042.14,749902.27,C,retailer,BUYER-00750,delivered,pending,2024-01-13T10:56:17.336399
ORD-00000084,13-01-2024,56:17.3,soybean,Bihar,rabi,151.41,5146.51,779243.2,B,trader,BUYER-00563,pending,paid,2024-01-13T10:56:17.336399
ORD-00000085,13-01-2024,56:17.3,sunflower,Haryana,rabi,616.19,3949.5,2433639.6,B,exporter,BUYER-00226,delivered,pending,2024-01-13T10:56:17.336399
ORD-00000086,13-01-2024,56:17.3,sunflower,Haryana,rabi,339.94,3965.42,1348015.22,A,retailer,BUYER-00879,delivered,partial,2024-01-13T10:56:17.336399
ORD-00000087,14-01-2024,56:17.3,mustard,Bihar,rabi,141.17,5120.33,722826.73,C,retailer,BUYER-00659,pending,partial,2024-01-14T10:56:17.336399
ORD-00000088,14-01-2024,56:17.3,sunflower,Gujarat,rabi,399.62,4106.15,1640910.38,C,processor,BUYER-00512,delivered,pending,2024-01-14T10:56:17.336399
ORD-00000089,15-01-2024,56:17.3,groundnut,Gujarat,rabi,746.32,5153.11,3845879.84,C,trader,BUYER-00046,delivered,pending,2024-01-15T10:56:17.336399
ORD-00000090,15-01-2024,56:17.3,mustard,Bihar,rabi,709.15,4613.03,3271348.86,A,exporter,BUYER-00745,pending,paid,2024-01-15T10:56:17.336399
ORD-00000091,16-01-2024,56:17.3,soybean,Andhra Pradesh,rabi,213.29,4403.05,939130.5,C,trader,BUYER-00181,completed,paid,2024-01-16T10:56:17.336399
ORD-00000092,16-01-2024,56:17.3,sunflower,Karnataka,rabi,479.75,4347.58,2085747.56,A,retailer,BUYER-00116,completed,paid,2024-01-16T10:56:17.336399
ORD-00000093,17-01-2024,56:17.3,groundnut,Uttar Pradesh,rabi,258.84,4717.82,1221150.69,C,processor,BUYER-00161,delivered,pending,2024-01-17T10:56:17.336399
ORD-00000094,17-01-2024,56:17.3,sesame,Karnataka,rabi,138.68,5855.51,812058.23,C,exporter,BUYER-00793,delivered,pending,2024-01-17T10:56:17.336399
ORD-00000095,17-01-2024,56:17.3,groundnut,Rajasthan,rabi,300.45,5736.97,1723654.63,C,processor,BUYER-00323,completed,pending,2024-01-17T10:56:17.336399
ORD-00000096,17-01-2024,56:17.3,groundnut,Rajasthan,rabi,404.62,4571.6,1849742.15,C,exporter,BUYER-00288,completed,partial,2024-01-17T10:56:17.336399
ORD-00000097,18-01-2024,56:17.3,groundnut,Madhya Pradesh,rabi,891.94,4638.53,4137308.18,B,retailer,BUYER-00155,delivered,partial,2024-01-18T10:56:17.336399
ORD-00000098,18-01-2024,56:17.3,sesame,Haryana,rabi,138.26,6153.97,850835.26,C,trader,BUYER-00104,delivered,partial,2024-01-18T10:56:17.336399
ORD-00000099,18-01-2024,56:17.3,sesame,Gujarat,rabi,327.29,6894.84,2256622.96,C,exporter,BUYER-00176,completed,partial,2024-01-18T10:56:17.336399
ORD-00000100,18-01-2024,56:17.3,mustard,Uttar Pradesh,rabi,549.73,4506.97,2477641.42,B,retailer,BUYER-00538,pending,pending,2024-01-18T10:56:17.336399
ORD-00000101,19-01-2024,56:17.3,sesame,Uttar Pradesh,rabi,136.86,6717.45,919368.63,C,retailer,BUYER-00828,delivered,pending,2024-01-19T10:56:17.336399
ORD-00000102,19-01-2024,56:17.3,soybean,Odisha,rabi,142.85,4502.05,643131.28,B,retailer,BUYER-00685,delivered,pending,2024-01-19T10:56:17.336399
ORD-00000103,19-01-2024,56:17.3,sunflower,Haryana,rabi,225.1,3310.87,745275.22,A,retailer,BUYER-00400,completed,paid,2024-01-19T10:56:17.336399
ORD-00000104,19-01-2024,56:17.3,mustard,Odisha,rabi,118.88,5356.73,636831.53,A,retailer,BUYER-00143,completed,pending,2024-01-19T10:56:17.336399
ORD-00000105,20-01-2024,56:17.3,mustard,Telangana,rabi,106.32,4912.72,522321.92,C,exporter,BUYER-00854,delivered,paid,2024-01-20T10:56:17.336399
ORD-00000106,20-01-2024,56:17.3,groundnut,Gujarat,rabi,370.63,4661.86,1727821.46,B,processor,BUYER-00190,pending,pending,2024-01-20T10:56:17.336399
ORD-00000107,20-01-2024,56:17.3,mustard,Maharashtra,rabi,372.2,4930.8,1835256.6,B,trader,BUYER-00342,delivered,pending,2024-01-20T10:56:17.336399
ORD-00000108,21-01-2024,56:17.3,sesame,Odisha,rabi,40.89,7129.07,291477,C,retailer,BUYER-00054,delivered,paid,2024-01-21T10:56:17.336399
ORD-00000109,21-01-2024,56:17.3,sunflower,Gujarat,rabi,473.99,3602.38,1707498.73,B,processor,BUYER-00264,delivered,pending,2024-01-21T10:56:17.336399
ORD-00000110,22-01-2024,56:17.3,mustard,Odisha,rabi,281.02,5469.96,1537175.01,A,exporter,BUYER-00103,completed,partial,2024-01-22T10:56:17.336399
ORD-00000111,22-01-2024,56:17.3,sesame,Maharashtra,rabi,103.44,5625.78,581904.96,B,processor,BUYER-00884,completed,partial,2024-01-22T10:56:17.336399
ORD-00000112,23-01-2024,56:17.3,mustard,Rajasthan,rabi,516.18,4997.9,2579830.61,B,retailer,BUYER-00820,completed,pending,2024-01-23T10:56:17.336399
ORD-00000113,23-01-2024,56:17.3,mustard,Telangana,rabi,189.62,5476.13,1038399.91,A,exporter,BUYER-00106,delivered,pending,2024-01-23T10:56:17.336399
ORD-00000114,23-01-2024,56:17.3,mustard,Andhra Pradesh,rabi,296.9,5225.07,1551334.36,B,trader,BUYER-00831,completed,pending,2024-01-23T10:56:17.336399
ORD-00000115,24-01-2024,56:17.3,soybean,Odisha,rabi,101,3930.92,397003.47,C,processor,BUYER-00741,delivered,paid,2024-01-24T10:56:17.336399
ORD-00000116,24-01-2024,56:17.3,soybean,Bihar,rabi,76.58,3934.18,301276.59,A,processor,BUYER-00127,completed,paid,2024-01-24T10:56:17.336399
ORD-00000117,24-01-2024,56:17.3,soybean,Punjab,rabi,287.65,4377.09,1259047.95,A,retailer,BUYER-00058,completed,pending,2024-01-24T10:56:17.336399
ORD-00000118,24-01-2024,56:17.3,soybean,Punjab,rabi,365.78,4422.18,1617552.97,A,exporter,BUYER-00096,pending,pending,2024-01-24T10:56:17.336399
ORD-00000119,25-01-2024,56:17.3,sunflower,Rajasthan,rabi,105.53,3438.47,362847.59,C,processor,BUYER-00237,completed,pending,2024-01-25T10:56:17.336399
ORD-00000120,25-01-2024,56:17.3,soybean,Punjab,rabi,139.37,5114.07,712739.7,A,trader,BUYER-00999,pending,partial,2024-01-25T10:56:17.336399
ORD-00000121,25-01-2024,56:17.3,mustard,Gujarat,rabi,553.12,4707.37,2603740.66,C,retailer,BUYER-00861,completed,partial,2024-01-25T10:56:17.336399
ORD-00000122,26-01-2024,56:17.3,groundnut,Madhya Pradesh,rabi,102.92,5303.02,545786.89,C,trader,BUYER-00435,pending,partial,2024-01-26T10:56:17.336399
ORD-00000123,26-01-2024,56:17.3,soybean,Punjab,rabi,309.7,3844.43,1190606.33,A,trader,BUYER-00974,pending,pending,2024-01-26T10:56:17.336399
ORD-00000124,26-01-2024,56:17.3,sunflower,Madhya Pradesh,rabi,113.95,3337.34,380304.31,C,trader,BUYER-00094,completed,pending,2024-01-26T10:56:17.336399
ORD-00000125,26-01-2024,56:17.3,mustard,Madhya Pradesh,rabi,835.12,5093.27,4253478.93,B,trader,BUYER-00204,pending,pending,2024-01-26T10:56:17.336399
ORD-00000126,27-01-2024,56:17.3,groundnut,Gujarat,rabi,885.41,5678.78,5028032.36,A,trader,BUYER-00612,pending,partial,2024-01-27T10:56:17.336399
ORD-00000127,27-01-2024,56:17.3,mustard,Uttar Pradesh,rabi,235.41,4704.75,1107549.75,B,trader,BUYER-00023,delivered,paid,2024-01-27T10:56:17.336399
ORD-00000128,27-01-2024,56:17.3,soybean,Andhra Pradesh,rabi,40.83,5106.35,208477.4,B,retailer,BUYER-00100,delivered,partial,2024-01-27T10:56:17.336399
ORD-00000129,28-01-2024,56:17.3,sesame,Bihar,rabi,120.53,5554.84,669522.74,B,trader,BUYER-00659,completed,pending,2024-01-28T10:56:17.336399
ORD-00000130,28-01-2024,56:17.3,sunflower,Rajasthan,rabi,395.27,4206.4,1662655.46,B,retailer,BUYER-00325,delivered,pending,2024-01-28T10:56:17.336399
ORD-00000131,28-01-2024,56:17.3,sunflower,Andhra Pradesh,rabi,353.49,3932.07,1389948.69,C,trader,BUYER-00336,pending,paid,2024-01-28T10:56:17.336399
ORD-00000132,29-01-2024,56:17.3,sesame,Karnataka,rabi,512.91,7216.04,3701151.14,A,retailer,BUYER-00160,pending,pending,2024-01-29T10:56:17.336399
ORD-00000133,29-01-2024,56:17.3,mustard,Haryana,rabi,953.78,4908.68,4681788.16,A,exporter,BUYER-00690,pending,partial,2024-01-29T10:56:17.336399
ORD-00000134,29-01-2024,56:17.3,mustard,Uttar Pradesh,rabi,680.1,4265.04,2900643.36,A,processor,BUYER-00957,delivered,paid,2024-01-29T10:56:17.336399
ORD-00000135,29-01-2024,56:17.3,mustard,Odisha,rabi,482.3,5435.71,2621647.88,A,trader,BUYER-00835,pending,partial,2024-01-29T10:56:17.336399
ORD-00000136,30-01-2024,56:17.3,sunflower,Uttar Pradesh,rabi,577.11,4262.1,2459712.15,C,trader,BUYER-00556,delivered,partial,2024-01-30T10:56:17.336399
ORD-00000137,30-01-2024,56:17.3,sesame,Telangana,rabi,140.36,5943.45,834215.52,B,exporter,BUYER-00302,delivered,pending,2024-01-30T10:56:17.336399
ORD-00000138,31-01-2024,56:17.3,sunflower,Karnataka,rabi,105.35,3934.81,414540.51,A,retailer,BUYER-00727,delivered,paid,2024-01-31T10:56:17.336399
ORD-00000139,31-01-2024,56:17.3,sesame,Odisha,rabi,75.31,6147,462918.65,A,retailer,BUYER-00922,completed,partial,2024-01-31T10:56:17.336399
ORD-00000140,31-01-2024,56:17.3,mustard,Andhra Pradesh,rabi,433.78,4570.5,1982586.65,C,trader,BUYER-00115,completed,paid,2024-01-31T10:56:17.336399
ORD-00000141,01-02-2024,56:17.3,sunflower,Karnataka,rabi,355.18,4019.9,1427793.99,B,retailer,BUYER-00626,delivered,paid,2024-02-01T10:56:17.336399
ORD-00000142,01-02-2024,56:17.3,sesame,Rajasthan,rabi,329.69,7236.07,2385689.28,B,processor,BUYER-00420,completed,partial,2024-02-01T10:56:17.336399
ORD-00000143,02-02-2024,56:17.3,sunflower,Odisha,rabi,545.74,3551.52,1938195.8,A,exporter,BUYER-00394,completed,paid,2024-02-02T10:56:17.336399
ORD-00000144,02-02-2024,56:17.3,sesame,Andhra Pradesh,rabi,205.68,6633.61,1364404.79,B,exporter,BUYER-00739,delivered,pending,2024-02-02T10:56:17.336399
ORD-00000145,03-02-2024,56:17.3,groundnut,Maharashtra,rabi,739.52,4619.2,3415991.99,B,exporter,BUYER-00999,completed,paid,2024-02-03T10:56:17.336399
ORD-00000146,03-02-2024,56:17.3,mustard,Uttar Pradesh,rabi,687.23,5328.65,3661998.88,A,processor,BUYER-00736,completed,paid,2024-02-03T10:56:17.336399
ORD-00000147,04-02-2024,56:17.3,sesame,Andhra Pradesh,rabi,161.46,6850.7,1106114.76,A,retailer,BUYER-00279,completed,partial,2024-02-04T10:56:17.336399
ORD-00000148,04-02-2024,56:17.3,mustard,Punjab,rabi,548.48,4228.5,2319239.87,C,retailer,BUYER-00273,pending,pending,2024-02-04T10:56:17.336399
ORD-00000149,05-02-2024,56:17.3,mustard,Uttar Pradesh,rabi,510.35,5270.1,2689589.44,B,exporter,BUYER-00342,delivered,partial,2024-02-05T10:56:17.336399
ORD-00000150,05-02-2024,56:17.3,sesame,Maharashtra,rabi,172.16,5719.97,984772.64,C,processor,BUYER-00612,completed,partial,2024-02-05T10:56:17.336399
ORD-00000151,06-02-2024,56:17.3,groundnut,Andhra Pradesh,rabi,521.46,4562.41,2379117.22,C,processor,BUYER-00455,completed,paid,2024-02-06T10:56:17.336399
ORD-00000152,06-02-2024,56:17.3,groundnut,Haryana,rabi,908.26,5475.76,4973410.09,A,retailer,BUYER-00564,completed,pending,2024-02-06T10:56:17.336399
ORD-00000153,07-02-2024,56:17.3,mustard,Odisha,rabi,295.79,4199.93,1242277.68,C,exporter,BUYER-00069,delivered,paid,2024-02-07T10:56:17.336399
ORD-00000154,07-02-2024,56:17.3,groundnut,Andhra Pradesh,rabi,207.42,4932.72,1023129.92,C,trader,BUYER-00891,pending,pending,2024-02-07T10:56:17.336399
ORD-00000155,07-02-2024,56:17.3,soybean,Bihar,rabi,83.94,5102.36,428287.58,A,trader,BUYER-00144,pending,partial,2024-02-07T10:56:17.336399
ORD-00000156,07-02-2024,56:17.3,groundnut,Gujarat,rabi,911.99,4562.28,4160747.69,A,retailer,BUYER-00042,pending,paid,2024-02-07T10:56:17.336399
ORD-00000157,08-02-2024,56:17.3,sunflower,Rajasthan,rabi,130.25,3856.46,502292.24,A,processor,BUYER-00133,completed,pending,2024-02-08T10:56:17.336399
ORD-00000158,08-02-2024,56:17.3,sesame,Odisha,rabi,233.58,6589.54,1539181.07,C,trader,BUYER-00843,delivered,paid,2024-02-08T10:56:17.336399
ORD-00000159,08-02-2024,56:17.3,mustard,Odisha,rabi,139.65,4285.91,598505.69,B,exporter,BUYER-00074,delivered,partial,2024-02-08T10:56:17.336399
ORD-00000160,09-02-2024,56:17.3,sesame,Uttar Pradesh,rabi,339.69,5722.19,1943742.21,B,processor,BUYER-00519,pending,paid,2024-02-09T10:56:17.336399
ORD-00000161,09-02-2024,56:17.3,mustard,Odisha,rabi,328.77,4400.51,1446746.81,B,trader,BUYER-00393,completed,paid,2024-02-09T10:56:17.336399
ORD-00000162,09-02-2024,56:17.3,groundnut,Bihar,rabi,403.04,5521.74,2225500.81,C,processor,BUYER-00517,pending,pending,2024-02-09T10:56:17.336399
ORD-00000163,10-02-2024,56:17.3,sesame,Maharashtra,rabi,123.8,7448.95,922183.14,A,exporter,BUYER-00496,pending,partial,2024-02-10T10:56:17.336399
ORD-00000164,10-02-2024,56:17.3,mustard,Andhra Pradesh,rabi,799.66,5347.72,4276378.38,A,exporter,BUYER-00657,pending,pending,2024-02-10T10:56:17.336399
ORD-00000165,11-02-2024,56:17.3,soybean,Uttar Pradesh,rabi,316.34,4624.05,1462766.81,B,exporter,BUYER-00804,delivered,pending,2024-02-11T10:56:17.336399
ORD-00000166,11-02-2024,56:17.3,soybean,Rajasthan,rabi,144.75,3937.73,569982.28,B,exporter,BUYER-00445,pending,pending,2024-02-11T10:56:17.336399
ORD-00000167,11-02-2024,56:17.3,sunflower,Bihar,rabi,228.9,4033.8,923328.65,B,processor,BUYER-00714,delivered,paid,2024-02-11T10:56:17.336399
ORD-00000168,11-02-2024,56:17.3,sunflower,Andhra Pradesh,rabi,565.46,3356.77,1898104.49,B,processor,BUYER-00451,delivered,partial,2024-02-11T10:56:17.336399
ORD-00000169,12-02-2024,56:17.3,soybean,Bihar,rabi,21.16,4457.69,94333.27,C,exporter,BUYER-00058,delivered,paid,2024-02-12T10:56:17.336399
ORD-00000170,12-02-2024,56:17.3,groundnut,Haryana,rabi,603.92,5616.82,3392085.51,B,exporter,BUYER-00895,pending,pending,2024-02-12T10:56:17.336399
ORD-00000171,13-02-2024,56:17.3,soybean,Karnataka,rabi,230.94,4744.4,1095658.95,B,retailer,BUYER-00348,delivered,pending,2024-02-13T10:56:17.336399
ORD-00000172,13-02-2024,56:17.3,mustard,Madhya Pradesh,rabi,1112.78,4619.81,5140838.52,A,retailer,BUYER-00369,pending,paid,2024-02-13T10:56:17.336399
ORD-00000173,14-02-2024,56:17.3,sunflower,Haryana,rabi,722.14,3484.9,2516600.54,A,exporter,BUYER-00134,completed,paid,2024-02-14T10:56:17.336399
ORD-00000174,14-02-2024,56:17.3,soybean,Uttar Pradesh,rabi,340.27,5145.17,1750724.54,A,retailer,BUYER-00173,delivered,partial,2024-02-14T10:56:17.336399
ORD-00000175,15-02-2024,56:17.3,sunflower,Haryana,rabi,213.17,3279.48,699079.83,C,trader,BUYER-00213,delivered,pending,2024-02-15T10:56:17.336399
ORD-00000176,15-02-2024,56:17.3,mustard,Karnataka,rabi,794.93,4186.27,3327808.75,B,retailer,BUYER-00227,delivered,paid,2024-02-15T10:56:17.336399
ORD-00000177,16-02-2024,56:17.3,sesame,Haryana,rabi,367.56,6545.04,2405673.74,C,retailer,BUYER-00233,completed,pending,2024-02-16T10:56:17.336399
ORD-00000178,16-02-2024,56:17.3,mustard,Telangana,rabi,169.99,4504.07,765664.38,C,trader,BUYER-00513,completed,pending,2024-02-16T10:56:17.336399
ORD-00000179,16-02-2024,56:17.3,sunflower,Punjab,rabi,380.27,3896.12,1481564.83,C,exporter,BUYER-00656,completed,pending,2024-02-16T10:56:17.336399
ORD-00000180,16-02-2024,56:17.3,sesame,Uttar Pradesh,rabi,395.05,7309.75,2887749.16,B,trader,BUYER-00330,pending,partial,2024-02-16T10:56:17.336399
ORD-00000181,17-02-2024,56:17.3,mustard,Uttar Pradesh,rabi,469.28,4972.99,2333744.04,B,retailer,BUYER-00008,pending,paid,2024-02-17T10:56:17.336399
ORD-00000182,17-02-2024,56:17.3,sesame,Gujarat,rabi,170.58,6786.35,1157619.99,A,exporter,BUYER-00648,completed,pending,2024-02-17T10:56:17.336399
ORD-00000183,17-02-2024,56:17.3,mustard,Odisha,rabi,284.25,4920.46,1398649.81,B,exporter,BUYER-00732,pending,partial,2024-02-17T10:56:17.336399
ORD-00000184,18-02-2024,56:17.3,groundnut,Uttar Pradesh,rabi,1011.15,5958.49,6024918.54,A,retailer,BUYER-00502,pending,partial,2024-02-18T10:56:17.336399
ORD-00000185,18-02-2024,56:17.3,sunflower,Madhya Pradesh,rabi,100.69,3548.93,357326.89,B,processor,BUYER-00724,pending,pending,2024-02-18T10:56:17.336399
ORD-00000186,19-02-2024,56:17.3,soybean,Odisha,rabi,219.17,4044.53,886460.35,A,exporter,BUYER-00558,pending,paid,2024-02-19T10:56:17.336399
ORD-00000187,19-02-2024,56:17.3,soybean,Uttar Pradesh,rabi,58.16,5094.72,296309.91,B,trader,BUYER-00883,pending,partial,2024-02-19T10:56:17.336399
ORD-00000188,20-02-2024,56:17.3,mustard,Bihar,rabi,500.79,4682.27,2344846.08,A,trader,BUYER-00824,pending,partial,2024-02-20T10:56:17.336399
ORD-00000189,20-02-2024,56:17.3,mustard,Telangana,rabi,512.06,4874.29,2495933.57,C,exporter,BUYER-00005,pending,paid,2024-02-20T10:56:17.336399
ORD-00000190,21-02-2024,56:17.3,sesame,Madhya Pradesh,rabi,304.64,7041.32,2145097.13,A,trader,BUYER-00146,completed,partial,2024-02-21T10:56:17.336399
ORD-00000191,21-02-2024,56:17.3,soybean,Gujarat,rabi,444.85,4028.06,1791870.98,A,processor,BUYER-00853,delivered,paid,2024-02-21T10:56:17.336399
ORD-00000192,21-02-2024,56:17.3,sunflower,Maharashtra,rabi,785.47,3678.01,2888947.11,A,trader,BUYER-00827,completed,pending,2024-02-21T10:56:17.336399
ORD-00000193,21-02-2024,56:17.3,sunflower,Telangana,rabi,501.88,4185.69,2100698.11,B,retailer,BUYER-00610,completed,partial,2024-02-21T10:56:17.336399
ORD-00000194,22-02-2024,56:17.3,mustard,Punjab,rabi,333.23,4473.71,1490771.49,C,retailer,BUYER-00823,completed,paid,2024-02-22T10:56:17.336399
ORD-00000195,22-02-2024,56:17.3,soybean,Punjab,rabi,289.82,4922.42,1426627.24,B,retailer,BUYER-00863,delivered,partial,2024-02-22T10:56:17.336399
ORD-00000196,23-02-2024,56:17.3,groundnut,Karnataka,rabi,747.73,5286.47,3952854.09,B,trader,BUYER-00997,delivered,pending,2024-02-23T10:56:17.336399
ORD-00000197,23-02-2024,56:17.3,soybean,Uttar Pradesh,rabi,259.96,4847.06,1260044.15,B,retailer,BUYER-00083,completed,pending,2024-02-23T10:56:17.336399
ORD-00000198,24-02-2024,56:17.3,sunflower,Punjab,rabi,226.64,3463.75,785018.06,B,exporter,BUYER-00001,pending,pending,2024-02-24T10:56:17.336399
ORD-00000199,24-02-2024,56:17.3,mustard,Andhra Pradesh,rabi,874.29,4952.89,4330239.13,A,exporter,BUYER-00446,delivered,paid,2024-02-24T10:56:17.336399
ORD-00000200,25-02-2024,56:17.3,groundnut,Gujarat,rabi,528.4,5384.28,2845042.61,C,trader,BUYER-00348,pending,pending,2024-02-25T10:56:17.336399
ORD-00000201,25-02-2024,56:17.3,sunflower,Maharashtra,rabi,231.06,3255.29,752168.55,C,exporter,BUYER-00250,delivered,paid,2024-02-25T10:56:17.336399
ORD-00000202,26-02-2024,56:17.3,sesame,Bihar,rabi,152.23,7146.17,1087889.38,C,processor,BUYER-00306,pending,partial,2024-02-26T10:56:17.336399
ORD-00000203,26-02-2024,56:17.3,mustard,Andhra Pradesh,rabi,790.67,4874.75,3854318.1,A,trader,BUYER-00389,completed,partial,2024-02-26T10:56:17.336399
ORD-00000204,26-02-2024,56:17.3,groundnut,Punjab,rabi,148.14,5655.24,837784.2,B,retailer,BUYER-00401,pending,paid,2024-02-26T10:56:17.336399
ORD-00000205,27-02-2024,56:17.3,soybean,Andhra Pradesh,rabi,35.88,4844.44,173831.69,B,processor,BUYER-00853,pending,pending,2024-02-27T10:56:17.336399
ORD-00000206,27-02-2024,56:17.3,groundnut,Madhya Pradesh,rabi,607.88,5675.87,3450262.98,B,trader,BUYER-00103,pending,pending,2024-02-27T10:56:17.336399
ORD-00000207,27-02-2024,56:17.3,groundnut,Karnataka,rabi,200.46,4442.69,890585.55,A,trader,BUYER-00806,pending,partial,2024-02-27T10:56:17.336399
ORD-00000208,27-02-2024,56:17.3,sunflower,Rajasthan,rabi,462.8,3955.77,1830750.38,B,exporter,BUYER-00335,delivered,partial,2024-02-27T10:56:17.336399
ORD-00000209,28-02-2024,56:17.3,sunflower,Madhya Pradesh,rabi,141.88,4058.09,575776.25,B,processor,BUYER-00249,completed,paid,2024-02-28T10:56:17.336399
ORD-00000210,28-02-2024,56:17.3,mustard,Haryana,rabi,472.58,5208.46,2461393.63,B,processor,BUYER-00542,delivered,paid,2024-02-28T10:56:17.336399
ORD-00000211,28-02-2024,56:17.3,sunflower,Haryana,rabi,540.44,4213.09,2276925.31,A,exporter,BUYER-00133,delivered,partial,2024-02-28T10:56:17.336399
ORD-00000212,28-02-2024,56:17.3,sunflower,Punjab,rabi,584.03,3753.66,2192245.79,B,trader,BUYER-00401,completed,partial,2024-02-28T10:56:17.336399
ORD-00000213,29-02-2024,56:17.3,groundnut,Uttar Pradesh,rabi,819.75,4523.33,3707984.1,A,trader,BUYER-00069,pending,paid,2024-02-29T10:56:17.336399
ORD-00000214,29-02-2024,56:17.3,soybean,Bihar,rabi,235.69,4490.03,1058242.91,B,trader,BUYER-00205,pending,pending,2024-02-29T10:56:17.336399
ORD-00000215,29-02-2024,56:17.3,soybean,Rajasthan,rabi,114.13,4607.53,525876.52,A,processor,BUYER-00971,delivered,pending,2024-02-29T10:56:17.336399
ORD-00000216,01-03-2024,56:17.3,soybean,Madhya Pradesh,rabi,252.09,4446.16,1120823.87,A,retailer,BUYER-00848,delivered,pending,2024-03-01T10:56:17.336399
ORD-00000217,01-03-2024,56:17.3,sunflower,Bihar,rabi,98.47,3388.26,333650.28,C,exporter,BUYER-00520,pending,partial,2024-03-01T10:56:17.336399
ORD-00000218,01-03-2024,56:17.3,groundnut,Gujarat,rabi,196.55,5506.54,1082285.61,C,processor,BUYER-00281,delivered,partial,2024-03-01T10:56:17.336399
ORD-00000219,01-03-2024,56:17.3,mustard,Andhra Pradesh,rabi,827.28,4762.5,3939943.64,A,trader,BUYER-00093,completed,pending,2024-03-01T10:56:17.336399
ORD-00000220,02-03-2024,56:17.3,mustard,Karnataka,rabi,513.39,4402.34,2260134.04,B,processor,BUYER-00789,pending,pending,2024-03-02T10:56:17.336399
ORD-00000221,02-03-2024,56:17.3,sesame,Bihar,rabi,90.73,6068.25,550602.53,B,processor,BUYER-00829,delivered,pending,2024-03-02T10:56:17.336399
ORD-00000222,02-03-2024,56:17.3,groundnut,Madhya Pradesh,rabi,115.76,5276,610758.74,B,processor,BUYER-00645,pending,paid,2024-03-02T10:56:17.336399
ORD-00000223,03-03-2024,56:17.3,sesame,Maharashtra,rabi,295.12,7268.72,2145112.43,A,trader,BUYER-00945,completed,paid,2024-03-03T10:56:17.336399
ORD-00000224,03-03-2024,56:17.3,sesame,Karnataka,rabi,298.66,6871.27,2052178.93,A,retailer,BUYER-00073,pending,paid,2024-03-03T10:56:17.336399
ORD-00000225,04-03-2024,56:17.3,groundnut,Telangana,rabi,663.77,5399.52,3584043.43,A,processor,BUYER-00239,delivered,paid,2024-03-04T10:56:17.336399
ORD-00000226,04-03-2024,56:17.3,groundnut,Haryana,rabi,441.39,4664.89,2059019.25,B,retailer,BUYER-00048,completed,partial,2024-03-04T10:56:17.336399
ORD-00000227,04-03-2024,56:17.3,soybean,Rajasthan,rabi,61.37,4198.78,257671.8,A,trader,BUYER-00257,completed,partial,2024-03-04T10:56:17.336399
ORD-00000228,05-03-2024,56:17.3,sunflower,Maharashtra,rabi,646.48,4354.33,2814971.67,A,trader,BUYER-00303,completed,paid,2024-03-05T10:56:17.336399
ORD-00000229,05-03-2024,56:17.3,mustard,Haryana,rabi,436.89,4777.71,2087346.02,A,processor,BUYER-00474,delivered,pending,2024-03-05T10:56:17.336399
ORD-00000230,06-03-2024,56:17.3,sunflower,Haryana,rabi,315.66,4051.39,1278877.41,C,processor,BUYER-00666,delivered,partial,2024-03-06T10:56:17.336399
ORD-00000231,06-03-2024,56:17.3,groundnut,Punjab,rabi,131.68,4813.8,633904.19,A,trader,BUYER-00007,delivered,partial,2024-03-06T10:56:17.336399
ORD-00000232,06-03-2024,56:17.3,soybean,Maharashtra,rabi,280.2,4964.99,1391167.21,B,exporter,BUYER-00363,delivered,partial,2024-03-06T10:56:17.336399
ORD-00000233,06-03-2024,56:17.3,soybean,Uttar Pradesh,rabi,159.78,3969.68,634263.87,C,exporter,BUYER-00506,completed,paid,2024-03-06T10:56:17.336399
ORD-00000234,07-03-2024,56:17.3,sunflower,Punjab,rabi,497.09,3506.42,1742994.18,A,processor,BUYER-00985,completed,pending,2024-03-07T10:56:17.336399
ORD-00000235,07-03-2024,56:17.3,sesame,Bihar,rabi,219.94,5880.45,1293320.08,C,trader,BUYER-00039,delivered,partial,2024-03-07T10:56:17.336399
ORD-00000236,07-03-2024,56:17.3,sesame,Andhra Pradesh,rabi,166.67,5937.32,989573.48,B,exporter,BUYER-00474,completed,partial,2024-03-07T10:56:17.336399
ORD-00000237,08-03-2024,56:17.3,soybean,Bihar,rabi,39.89,5027.21,200560.09,C,retailer,BUYER-00212,delivered,pending,2024-03-08T10:56:17.336399
ORD-00000238,08-03-2024,56:17.3,groundnut,Gujarat,rabi,493.66,4973.96,2455457.07,B,exporter,BUYER-00233,delivered,pending,2024-03-08T10:56:17.336399
ORD-00000239,08-03-2024,56:17.3,soybean,Telangana,rabi,148.12,3942.34,583945.49,B,trader,BUYER-00111,pending,pending,2024-03-08T10:56:17.336399
ORD-00000240,09-03-2024,56:17.3,sunflower,Rajasthan,rabi,359.31,4079.8,1465896.19,C,exporter,BUYER-00369,completed,paid,2024-03-09T10:56:17.336399
ORD-00000241,09-03-2024,56:17.3,soybean,Madhya Pradesh,rabi,218.88,4336.34,949158.57,B,processor,BUYER-00613,pending,partial,2024-03-09T10:56:17.336399
ORD-00000242,09-03-2024,56:17.3,sunflower,Rajasthan,rabi,244.11,3966.35,968243.54,C,processor,BUYER-00738,pending,partial,2024-03-09T10:56:17.336399
ORD-00000243,10-03-2024,56:17.3,sesame,Telangana,rabi,136.24,7448.7,1014795.19,C,processor,BUYER-00741,delivered,pending,2024-03-10T10:56:17.336399
ORD-00000244,10-03-2024,56:17.3,mustard,Odisha,rabi,767.3,4090.85,3138922.21,A,trader,BUYER-00277,pending,pending,2024-03-10T10:56:17.336399
ORD-00000245,10-03-2024,56:17.3,sunflower,Madhya Pradesh,rabi,148.25,3510.39,520400.47,C,retailer,BUYER-00516,completed,partial,2024-03-10T10:56:17.336399
ORD-00000246,10-03-2024,56:17.3,mustard,Karnataka,rabi,831.11,4206.56,3496097.15,A,trader,BUYER-00350,pending,pending,2024-03-10T10:56:17.336399
ORD-00000247,11-03-2024,56:17.3,soybean,Andhra Pradesh,rabi,34.22,4962.12,169804.36,C,retailer,BUYER-00899,delivered,partial,2024-03-11T10:56:17.336399
ORD-00000248,11-03-2024,56:17.3,sesame,Punjab,rabi,226.54,6325.27,1432901.34,C,processor,BUYER-00548,pending,partial,2024-03-11T10:56:17.336399
ORD-00000249,11-03-2024,56:17.3,sunflower,Maharashtra,rabi,1011.5,4252.14,4301015.7,A,trader,BUYER-00468,pending,pending,2024-03-11T10:56:17.336399
ORD-00000250,11-03-2024,56:17.3,sunflower,Telangana,rabi,682.71,4216.68,2878774.31,A,retailer,BUYER-00646,completed,partial,2024-03-11T10:56:17.336399
ORD-00000251,12-03-2024,56:17.3,mustard,Madhya Pradesh,rabi,382.59,4326.08,1655130.03,A,processor,BUYER-00947,completed,partial,2024-03-12T10:56:17.336399
ORD-00000252,12-03-2024,56:17.3,sesame,Karnataka,rabi,377.45,6925.99,2614207.92,B,exporter,BUYER-00715,delivered,pending,2024-03-12T10:56:17.336399
ORD-00000253,12-03-2024,56:17.3,groundnut,Telangana,rabi,414.75,4856.77,2014367.14,B,trader,BUYER-00300,pending,partial,2024-03-12T10:56:17.336399
ORD-00000254,13-03-2024,56:17.3,soybean,Maharashtra,rabi,125.58,4261.97,535229.86,A,retailer,BUYER-00787,pending,paid,2024-03-13T10:56:17.336399
ORD-00000255,13-03-2024,56:17.3,soybean,Andhra Pradesh,rabi,79.67,4818.93,383941.44,B,exporter,BUYER-00140,delivered,partial,2024-03-13T10:56:17.336399
ORD-00000256,14-03-2024,56:17.3,mustard,Gujarat,rabi,736.51,5185.6,3819232.97,B,retailer,BUYER-00550,pending,paid,2024-03-14T10:56:17.336399
ORD-00000257,14-03-2024,56:17.3,sunflower,Gujarat,rabi,607.54,3405.97,2069253.35,A,trader,BUYER-00868,pending,partial,2024-03-14T10:56:17.336399
ORD-00000258,14-03-2024,56:17.3,sesame,Uttar Pradesh,rabi,160.87,6683.07,1075114.36,C,trader,BUYER-00902,completed,paid,2024-03-14T10:56:17.336399
ORD-00000259,14-03-2024,56:17.3,mustard,Punjab,rabi,425.51,4273.56,1818435.77,A,processor,BUYER-00919,completed,pending,2024-03-14T10:56:17.336399
ORD-00000260,15-03-2024,56:17.3,groundnut,Rajasthan,rabi,817.55,4922.87,4024671.71,B,trader,BUYER-00642,delivered,paid,2024-03-15T10:56:17.336399
ORD-00000261,15-03-2024,56:17.3,soybean,Uttar Pradesh,rabi,49.43,4012.41,198319.31,C,exporter,BUYER-00329,completed,paid,2024-03-15T10:56:17.336399
ORD-00000262,15-03-2024,56:17.3,mustard,Haryana,rabi,526.99,4937.72,2602108.26,C,retailer,BUYER-00920,pending,partial,2024-03-15T10:56:17.336399
ORD-00000263,16-03-2024,56:17.3,sunflower,Madhya Pradesh,rabi,367.11,3627.71,1331776.98,B,processor,BUYER-00817,delivered,paid,2024-03-16T10:56:17.336399
ORD-00000264,16-03-2024,56:17.3,mustard,Madhya Pradesh,rabi,831.03,5154.2,4283289.98,B,exporter,BUYER-00946,pending,pending,2024-03-16T10:56:17.336399
ORD-00000265,16-03-2024,56:17.3,mustard,Andhra Pradesh,rabi,193.22,5132.45,991708.05,A,exporter,BUYER-00137,completed,pending,2024-03-16T10:56:17.336399
ORD-00000266,17-03-2024,56:17.3,groundnut,Punjab,rabi,217.07,4523.73,981946.85,B,trader,BUYER-00296,completed,pending,2024-03-17T10:56:17.336399
ORD-00000267,17-03-2024,56:17.3,soybean,Karnataka,rabi,224.83,3889.93,874576.62,B,exporter,BUYER-00349,pending,paid,2024-03-17T10:56:17.336399
ORD-00000268,17-03-2024,56:17.3,mustard,Andhra Pradesh,rabi,137.28,5225.18,717331.39,C,trader,BUYER-00270,completed,pending,2024-03-17T10:56:17.336399
ORD-00000269,18-03-2024,56:17.3,groundnut,Madhya Pradesh,rabi,606.69,4710.79,2857971.3,C,processor,BUYER-00851,pending,partial,2024-03-18T10:56:17.336399
ORD-00000270,18-03-2024,56:17.3,groundnut,Telangana,rabi,471.61,5235.98,2469327.42,B,retailer,BUYER-00132,completed,paid,2024-03-18T10:56:17.336399
ORD-00000271,18-03-2024,56:17.3,groundnut,Andhra Pradesh,rabi,328.81,5337.76,1755125.8,A,retailer,BUYER-00402,pending,paid,2024-03-18T10:56:17.336399
ORD-00000272,19-03-2024,56:17.3,soybean,Rajasthan,rabi,195.99,5039.55,987725.35,C,exporter,BUYER-00637,delivered,partial,2024-03-19T10:56:17.336399
ORD-00000273,19-03-2024,56:17.3,sesame,Uttar Pradesh,rabi,153.69,6982.84,1073216.13,C,trader,BUYER-00143,pending,pending,2024-03-19T10:56:17.336399
ORD-00000274,19-03-2024,56:17.3,groundnut,Uttar Pradesh,rabi,641.43,4974.37,3190699.56,A,exporter,BUYER-00503,delivered,partial,2024-03-19T10:56:17.336399
ORD-00000275,19-03-2024,56:17.3,sunflower,Andhra Pradesh,rabi,285.86,3305.95,945050.34,C,processor,BUYER-00104,delivered,partial,2024-03-19T10:56:17.336399
ORD-00000276,20-03-2024,56:17.3,soybean,Andhra Pradesh,rabi,167.74,4407.56,739328.35,B,exporter,BUYER-00579,completed,paid,2024-03-20T10:56:17.336399
ORD-00000277,20-03-2024,56:17.3,sunflower,Andhra Pradesh,rabi,492.72,3611.79,1779596.94,A,processor,BUYER-00448,pending,partial,2024-03-20T10:56:17.336399
ORD-00000278,20-03-2024,56:17.3,sesame,Gujarat,rabi,140.66,7238.33,1018124.57,B,processor,BUYER-00289,delivered,partial,2024-03-20T10:56:17.336399
ORD-00000279,20-03-2024,56:17.3,groundnut,Telangana,rabi,313.26,5814.47,1821453.79,C,exporter,BUYER-00420,pending,paid,2024-03-20T10:56:17.336399
ORD-00000280,21-03-2024,56:17.3,soybean,Uttar Pradesh,rabi,97.91,4245.82,415725.94,A,trader,BUYER-00997,pending,paid,2024-03-21T10:56:17.336399
ORD-00000281,21-03-2024,56:17.3,sesame,Bihar,rabi,345.91,5804.1,2007688.94,A,processor,BUYER-00196,completed,partial,2024-03-21T10:56:17.336399
ORD-00000282,22-03-2024,56:17.3,mustard,Uttar Pradesh,rabi,546.6,4791.33,2618923.87,C,retailer,BUYER-00842,delivered,pending,2024-03-22T10:56:17.336399
ORD-00000283,22-03-2024,56:17.3,sunflower,Gujarat,rabi,331.4,4166.23,1380678.39,B,trader,BUYER-00159,pending,partial,2024-03-22T10:56:17.336399
ORD-00000284,22-03-2024,56:17.3,soybean,Bihar,rabi,84.66,4441.95,376057.14,C,trader,BUYER-00948,completed,pending,2024-03-22T10:56:17.336399
ORD-00000285,23-03-2024,56:17.3,soybean,Haryana,rabi,206.03,4027.39,829749.12,C,exporter,BUYER-00047,delivered,pending,2024-03-23T10:56:17.336399
ORD-00000286,23-03-2024,56:17.3,sesame,Rajasthan,rabi,231.69,7030.17,1628816.76,B,processor,BUYER-00411,pending,partial,2024-03-23T10:56:17.336399
ORD-00000287,23-03-2024,56:17.3,groundnut,Telangana,rabi,457,5502.56,2514654.25,B,exporter,BUYER-00292,completed,partial,2024-03-23T10:56:17.336399
ORD-00000288,23-03-2024,56:17.3,soybean,Andhra Pradesh,rabi,169.76,4633.69,786614.9,C,exporter,BUYER-00660,pending,pending,2024-03-23T10:56:17.336399
ORD-00000289,24-03-2024,56:17.3,groundnut,Bihar,rabi,462.32,4954.34,2290491.01,C,processor,BUYER-00134,pending,partial,2024-03-24T10:56:17.336399
ORD-00000290,24-03-2024,56:17.3,mustard,Haryana,rabi,387.04,4745.29,1836633.83,B,processor,BUYER-00302,delivered,pending,2024-03-24T10:56:17.336399
ORD-00000291,24-03-2024,56:17.3,groundnut,Karnataka,rabi,490.09,5842.49,2863354.15,B,exporter,BUYER-00616,completed,paid,2024-03-24T10:56:17.336399
ORD-00000292,24-03-2024,56:17.3,groundnut,Rajasthan,rabi,549.75,5373.87,2954267.14,A,trader,BUYER-00623,completed,partial,2024-03-24T10:56:17.336399
ORD-00000293,25-03-2024,56:17.3,sesame,Odisha,rabi,287.31,6627.01,1903975.51,C,processor,BUYER-00324,pending,pending,2024-03-25T10:56:17.336399
ORD-00000294,25-03-2024,56:17.3,sesame,Rajasthan,rabi,321.19,5569.89,1788972.92,C,exporter,BUYER-00127,completed,paid,2024-03-25T10:56:17.336399
ORD-00000295,25-03-2024,56:17.3,groundnut,Odisha,rabi,121.02,5319.01,643682.21,C,retailer,BUYER-00378,pending,pending,2024-03-25T10:56:17.336399
ORD-00000296,25-03-2024,56:17.3,soybean,Gujarat,rabi,60.76,3929.38,238753.34,B,retailer,BUYER-00462,delivered,partial,2024-03-25T10:56:17.336399
ORD-00000297,26-03-2024,56:17.3,sunflower,Odisha,rabi,515.49,3743.96,1929968.38,B,retailer,BUYER-00814,pending,paid,2024-03-26T10:56:17.336399
ORD-00000298,26-03-2024,56:17.3,sunflower,Uttar Pradesh,rabi,280.15,3418.69,957736.5,A,trader,BUYER-00420,pending,partial,2024-03-26T10:56:17.336399
ORD-00000299,27-03-2024,56:17.3,mustard,Uttar Pradesh,rabi,785.44,4558.29,3580274.77,B,exporter,BUYER-00950,pending,partial,2024-03-27T10:56:17.336399
ORD-00000300,27-03-2024,56:17.3,mustard,Rajasthan,rabi,598.7,4931.44,2952469.3,A,retailer,BUYER-00661,delivered,paid,2024-03-27T10:56:17.336399
ORD-00000301,27-03-2024,56:17.3,mustard,Telangana,rabi,254.23,5151.72,1309732.33,C,processor,BUYER-00202,pending,partial,2024-03-27T10:56:17.336399
ORD-00000302,28-03-2024,56:17.3,soybean,Andhra Pradesh,rabi,35.63,4275.22,152308,A,retailer,BUYER-00575,delivered,pending,2024-03-28T10:56:17.336399
ORD-00000303,28-03-2024,56:17.3,sesame,Rajasthan,rabi,234.16,7208.86,1688039.67,B,processor,BUYER-00806,completed,pending,2024-03-28T10:56:17.336399
ORD-00000304,29-03-2024,56:17.3,sunflower,Maharashtra,rabi,438.66,3778.15,1657343.78,B,processor,BUYER-00347,delivered,partial,2024-03-29T10:56:17.336399
ORD-00000305,29-03-2024,56:17.3,sunflower,Karnataka,rabi,329.55,3486.05,1148818.88,B,processor,BUYER-00876,delivered,paid,2024-03-29T10:56:17.336399
ORD-00000306,29-03-2024,56:17.3,soybean,Telangana,rabi,298.56,4160.11,1242031.77,A,trader,BUYER-00025,completed,paid,2024-03-29T10:56:17.336399
ORD-00000307,30-03-2024,56:17.3,soybean,Andhra Pradesh,rabi,70.95,3870.74,274644.91,B,retailer,BUYER-00161,pending,pending,2024-03-30T10:56:17.336399
ORD-00000308,30-03-2024,56:17.3,mustard,Punjab,rabi,450.02,4916.05,2212315.45,A,processor,BUYER-00662,completed,pending,2024-03-30T10:56:17.336399
ORD-00000309,30-03-2024,56:17.3,groundnut,Rajasthan,rabi,196.74,4751.78,934854.88,C,exporter,BUYER-00049,completed,pending,2024-03-30T10:56:17.336399
ORD-00000310,30-03-2024,56:17.3,groundnut,Andhra Pradesh,rabi,222.5,5919.27,1317029.67,A,processor,BUYER-00689,completed,pending,2024-03-30T10:56:17.336399
ORD-00000311,31-03-2024,56:17.3,sesame,Uttar Pradesh,rabi,543.11,6568.39,3567337.93,A,processor,BUYER-00360,delivered,partial,2024-03-31T10:56:17.336399
ORD-00000312,31-03-2024,56:17.3,sesame,Maharashtra,rabi,258.32,6686,1727158.07,C,retailer,BUYER-00141,pending,paid,2024-03-31T10:56:17.336399
ORD-00000313,31-03-2024,56:17.3,sunflower,Gujarat,rabi,446.15,3716.54,1658121.57,A,trader,BUYER-00952,completed,partial,2024-03-31T10:56:17.336399
ORD-00000314,01-04-2024,56:17.3,mustard,Rajasthan,zaid,54.71,4754.25,260091.8,C,processor,BUYER-00305,pending,pending,2024-04-01T10:56:17.336399
ORD-00000315,01-04-2024,56:17.3,soybean,Haryana,zaid,16.74,4462.29,74719.86,C,processor,BUYER-00424,delivered,pending,2024-04-01T10:56:17.336399
ORD-00000316,01-04-2024,56:17.3,soybean,Bihar,zaid,75.44,4221.96,318525.75,B,trader,BUYER-00371,delivered,partial,2024-04-01T10:56:17.336399
ORD-00000317,01-04-2024,56:17.3,soybean,Telangana,zaid,82.29,4532.93,373012.34,A,trader,BUYER-00988,completed,partial,2024-04-01T10:56:17.336399
ORD-00000318,02-04-2024,56:17.3,soybean,Punjab,zaid,60.81,4580.51,278544.07,C,trader,BUYER-00831,completed,paid,2024-04-02T10:56:17.336399
ORD-00000319,02-04-2024,56:17.3,sunflower,Haryana,zaid,20.23,3611.17,73060.36,B,retailer,BUYER-00055,pending,pending,2024-04-02T10:56:17.336399
ORD-00000320,03-04-2024,56:17.3,mustard,Bihar,zaid,112.02,4472.11,500969.46,A,retailer,BUYER-00979,completed,partial,2024-04-03T10:56:17.336399
ORD-00000321,03-04-2024,56:17.3,mustard,Maharashtra,zaid,132.52,4668.58,618688.81,B,retailer,BUYER-00087,completed,paid,2024-04-03T10:56:17.336399
ORD-00000322,03-04-2024,56:17.3,soybean,Telangana,zaid,132.44,4958.71,656733.05,B,exporter,BUYER-00391,pending,pending,2024-04-03T10:56:17.336399
ORD-00000323,03-04-2024,56:17.3,sunflower,Maharashtra,zaid,72.08,3260.89,235029.52,C,retailer,BUYER-00759,delivered,pending,2024-04-03T10:56:17.336399
ORD-00000324,04-04-2024,56:17.3,soybean,Bihar,zaid,36.96,4732.06,174878.2,B,trader,BUYER-00328,completed,pending,2024-04-04T10:56:17.336399
ORD-00000325,04-04-2024,56:17.3,mustard,Gujarat,zaid,29.05,5231.88,152010.46,C,exporter,BUYER-00579,delivered,pending,2024-04-04T10:56:17.336399
ORD-00000326,04-04-2024,56:17.3,groundnut,Uttar Pradesh,zaid,165.36,5288.49,874522.27,C,exporter,BUYER-00264,delivered,partial,2024-04-04T10:56:17.336399
ORD-00000327,04-04-2024,56:17.3,sunflower,Madhya Pradesh,zaid,18.19,3507.22,63802.35,C,exporter,BUYER-00078,completed,pending,2024-04-04T10:56:17.336399
ORD-00000328,05-04-2024,56:17.3,sesame,Rajasthan,zaid,186.38,6299.51,1174124.54,C,trader,BUYER-00165,delivered,paid,2024-04-05T10:56:17.336399
ORD-00000329,05-04-2024,56:17.3,soybean,Telangana,zaid,24.51,4373.63,107211.46,C,trader,BUYER-00823,delivered,pending,2024-04-05T10:56:17.336399
ORD-00000330,05-04-2024,56:17.3,sesame,Odisha,zaid,192.67,5550.35,1069410.11,B,retailer,BUYER-00775,pending,pending,2024-04-05T10:56:17.336399
ORD-00000331,06-04-2024,56:17.3,sunflower,Uttar Pradesh,zaid,39.62,3260.25,129169.26,A,trader,BUYER-00381,pending,pending,2024-04-06T10:56:17.336399
ORD-00000332,06-04-2024,56:17.3,sunflower,Bihar,zaid,85.32,3962.94,338136.52,A,processor,BUYER-00082,pending,partial,2024-04-06T10:56:17.336399
ORD-00000333,07-04-2024,56:17.3,mustard,Telangana,zaid,99.31,4979.66,494542.87,C,retailer,BUYER-00523,completed,paid,2024-04-07T10:56:17.336399
ORD-00000334,07-04-2024,56:17.3,sesame,Bihar,zaid,66.7,6265.4,417878.5,B,processor,BUYER-00471,completed,paid,2024-04-07T10:56:17.336399
ORD-00000335,07-04-2024,56:17.3,groundnut,Bihar,zaid,20.93,5715.82,119625.55,B,trader,BUYER-00805,delivered,partial,2024-04-07T10:56:17.336399
ORD-00000336,08-04-2024,56:17.3,soybean,Punjab,zaid,157.7,4314.72,680420.24,A,exporter,BUYER-00053,delivered,pending,2024-04-08T10:56:17.336399
ORD-00000337,08-04-2024,56:17.3,mustard,Madhya Pradesh,zaid,52.56,5445.77,286244.86,C,retailer,BUYER-00854,pending,pending,2024-04-08T10:56:17.336399
ORD-00000338,08-04-2024,56:17.3,mustard,Telangana,zaid,86.59,4244.5,367542.32,C,trader,BUYER-00158,completed,paid,2024-04-08T10:56:17.336399
ORD-00000339,09-04-2024,56:17.3,soybean,Odisha,zaid,138.48,4904.8,679216.56,A,exporter,BUYER-00721,pending,pending,2024-04-09T10:56:17.336399
ORD-00000340,09-04-2024,56:17.3,sesame,Madhya Pradesh,zaid,160.89,6524.29,1049694.45,B,trader,BUYER-00521,pending,pending,2024-04-09T10:56:17.336399
ORD-00000341,09-04-2024,56:17.3,groundnut,Punjab,zaid,129.24,5408.23,698978.46,B,exporter,BUYER-00359,completed,paid,2024-04-09T10:56:17.336399
ORD-00000342,09-04-2024,56:17.3,groundnut,Madhya Pradesh,zaid,71.09,5426.28,385770.8,B,retailer,BUYER-00494,pending,pending,2024-04-09T10:56:17.336399
ORD-00000343,10-04-2024,56:17.3,soybean,Bihar,zaid,68.77,4056.77,279002.29,B,trader,BUYER-00727,pending,paid,2024-04-10T10:56:17.336399
ORD-00000344,10-04-2024,56:17.3,sesame,Haryana,zaid,187.65,7129.04,1337779.67,B,trader,BUYER-00128,completed,partial,2024-04-10T10:56:17.336399
ORD-00000345,10-04-2024,56:17.3,groundnut,Telangana,zaid,29.66,5319.37,157775.26,C,retailer,BUYER-00934,completed,paid,2024-04-10T10:56:17.336399
ORD-00000346,11-04-2024,56:17.3,groundnut,Karnataka,zaid,119.75,5436.22,650997.94,B,processor,BUYER-00378,delivered,partial,2024-04-11T10:56:17.336399
ORD-00000347,11-04-2024,56:17.3,sesame,Telangana,zaid,168.34,5732.83,965070.22,B,retailer,BUYER-00342,pending,paid,2024-04-11T10:56:17.336399
ORD-00000348,11-04-2024,56:17.3,soybean,Andhra Pradesh,zaid,31.81,5040.03,160300.93,B,exporter,BUYER-00646,pending,pending,2024-04-11T10:56:17.336399
ORD-00000349,12-04-2024,56:17.3,mustard,Punjab,zaid,126.26,4944.74,624318.54,A,retailer,BUYER-00821,delivered,partial,2024-04-12T10:56:17.336399
ORD-00000350,12-04-2024,56:17.3,soybean,Uttar Pradesh,zaid,44.48,5059.46,225026.35,B,trader,BUYER-00922,completed,partial,2024-04-12T10:56:17.336399
ORD-00000351,12-04-2024,56:17.3,sesame,Rajasthan,zaid,153.1,7028.28,1076038.42,A,exporter,BUYER-00558,pending,paid,2024-04-12T10:56:17.336399
ORD-00000352,12-04-2024,56:17.3,soybean,Haryana,zaid,26.89,4049.48,108886.18,A,trader,BUYER-00363,completed,paid,2024-04-12T10:56:17.336399
ORD-00000353,13-04-2024,56:17.3,sunflower,Odisha,zaid,24,3917.59,94022.24,A,trader,BUYER-00794,pending,pending,2024-04-13T10:56:17.336399
ORD-00000354,13-04-2024,56:17.3,soybean,Andhra Pradesh,zaid,27.6,4955.06,136777.55,A,trader,BUYER-00011,completed,partial,2024-04-13T10:56:17.336399
ORD-00000355,14-04-2024,56:17.3,sunflower,Punjab,zaid,65.95,3925.86,258892.51,C,processor,BUYER-00310,pending,partial,2024-04-14T10:56:17.336399
ORD-00000356,14-04-2024,56:17.3,groundnut,Punjab,zaid,93.01,5455.33,507380.24,C,retailer,BUYER-00758,completed,partial,2024-04-14T10:56:17.336399
ORD-00000357,15-04-2024,56:17.3,sesame,Odisha,zaid,129.08,5944.13,767289.77,C,trader,BUYER-00548,pending,paid,2024-04-15T10:56:17.336399
ORD-00000358,15-04-2024,56:17.3,soybean,Madhya Pradesh,zaid,126.55,4043.72,511714.15,A,trader,BUYER-00244,pending,paid,2024-04-15T10:56:17.336399
ORD-00000359,15-04-2024,56:17.3,sesame,Gujarat,zaid,36.57,6492.91,237451.12,C,processor,BUYER-00365,delivered,partial,2024-04-15T10:56:17.336399
ORD-00000360,16-04-2024,56:17.3,sesame,Andhra Pradesh,zaid,76.16,7028.28,535243.53,C,trader,BUYER-00501,delivered,paid,2024-04-16T10:56:17.336399
ORD-00000361,16-04-2024,56:17.3,mustard,Andhra Pradesh,zaid,58.42,4586.22,267914.07,B,processor,BUYER-00641,pending,paid,2024-04-16T10:56:17.336399
ORD-00000362,16-04-2024,56:17.3,groundnut,Uttar Pradesh,zaid,125.57,5493.91,689851.88,B,exporter,BUYER-00042,delivered,paid,2024-04-16T10:56:17.336399
ORD-00000363,16-04-2024,56:17.3,sunflower,Punjab,zaid,67.81,3316.56,224896.75,A,trader,BUYER-00498,pending,pending,2024-04-16T10:56:17.336399
ORD-00000364,17-04-2024,56:17.3,sunflower,Gujarat,zaid,24,4333.18,103996.26,A,trader,BUYER-00102,pending,partial,2024-04-17T10:56:17.336399
ORD-00000365,17-04-2024,56:17.3,soybean,Telangana,zaid,102.26,4312.31,440958.47,A,exporter,BUYER-00044,completed,pending,2024-04-17T10:56:17.336399
ORD-00000366,18-04-2024,56:17.3,mustard,Karnataka,zaid,166.6,4277.02,712571.86,A,processor,BUYER-00330,completed,pending,2024-04-18T10:56:17.336399
ORD-00000367,18-04-2024,56:17.3,mustard,Punjab,zaid,119.05,4830.67,575082.89,B,retailer,BUYER-00012,completed,pending,2024-04-18T10:56:17.336399
ORD-00000368,18-04-2024,56:17.3,sesame,Odisha,zaid,124.89,7227.24,902600.12,B,retailer,BUYER-00776,completed,pending,2024-04-18T10:56:17.336399
ORD-00000369,18-04-2024,56:17.3,sesame,Uttar Pradesh,zaid,194.08,7005.12,1359540.73,B,trader,BUYER-00485,delivered,paid,2024-04-18T10:56:17.336399
ORD-00000370,19-04-2024,56:17.3,soybean,Gujarat,zaid,101.03,5148.78,520161.87,C,exporter,BUYER-00466,completed,paid,2024-04-19T10:56:17.336399
ORD-00000371,19-04-2024,56:17.3,sesame,Telangana,zaid,145.93,5956.36,869212.97,A,processor,BUYER-00922,delivered,pending,2024-04-19T10:56:17.336399
ORD-00000372,19-04-2024,56:17.3,sesame,Bihar,zaid,23.43,6831.34,160056.88,C,exporter,BUYER-00288,delivered,partial,2024-04-19T10:56:17.336399
ORD-00000373,20-04-2024,56:17.3,soybean,Madhya Pradesh,zaid,113.3,5174.13,586222.04,B,retailer,BUYER-00794,delivered,partial,2024-04-20T10:56:17.336399
ORD-00000374,20-04-2024,56:17.3,sunflower,Gujarat,zaid,76.39,4273.66,326481.04,B,processor,BUYER-00782,delivered,paid,2024-04-20T10:56:17.336399
ORD-00000375,20-04-2024,56:17.3,sesame,Haryana,zaid,65.67,6950.5,456426.23,A,trader,BUYER-00883,pending,pending,2024-04-20T10:56:17.336399
ORD-00000376,21-04-2024,56:17.3,soybean,Gujarat,zaid,71.94,4898.71,352403.31,C,exporter,BUYER-00223,pending,pending,2024-04-21T10:56:17.336399
ORD-00000377,21-04-2024,56:17.3,sesame,Bihar,zaid,140.13,7171.87,1005024.03,C,processor,BUYER-00402,completed,paid,2024-04-21T10:56:17.336399
ORD-00000378,21-04-2024,56:17.3,mustard,Telangana,zaid,76.98,5008.15,385506.14,B,trader,BUYER-00526,completed,paid,2024-04-21T10:56:17.336399
ORD-00000379,22-04-2024,56:17.3,sesame,Haryana,zaid,112.41,6618.32,743963.59,B,processor,BUYER-00813,completed,paid,2024-04-22T10:56:17.336399
ORD-00000380,22-04-2024,56:17.3,groundnut,Odisha,zaid,28.77,5506.21,158434.82,B,exporter,BUYER-00936,pending,pending,2024-04-22T10:56:17.336399
ORD-00000381,22-04-2024,56:17.3,groundnut,Punjab,zaid,87.46,5051,441757.67,C,retailer,BUYER-00039,delivered,partial,2024-04-22T10:56:17.336399
ORD-00000382,22-04-2024,56:17.3,sunflower,Rajasthan,zaid,42.21,3845.02,162312.69,B,trader,BUYER-00349,pending,pending,2024-04-22T10:56:17.336399
ORD-00000383,23-04-2024,56:17.3,sesame,Haryana,zaid,81.24,6745.49,548031.95,C,exporter,BUYER-00016,pending,partial,2024-04-23T10:56:17.336399
ORD-00000384,23-04-2024,56:17.3,sunflower,Uttar Pradesh,zaid,66.81,4229.4,282568.99,A,trader,BUYER-00450,delivered,partial,2024-04-23T10:56:17.336399
ORD-00000385,23-04-2024,56:17.3,soybean,Gujarat,zaid,18.29,4999.63,91463.82,C,trader,BUYER-00414,pending,partial,2024-04-23T10:56:17.336399
ORD-00000386,24-04-2024,56:17.3,soybean,Punjab,zaid,146.39,4539.07,664488.26,B,trader,BUYER-00416,pending,partial,2024-04-24T10:56:17.336399
ORD-00000387,24-04-2024,56:17.3,sesame,Karnataka,zaid,187.87,5661.56,1063615.28,C,processor,BUYER-00814,pending,pending,2024-04-24T10:56:17.336399
ORD-00000388,24-04-2024,56:17.3,groundnut,Haryana,zaid,69.83,5616.81,392208.77,C,exporter,BUYER-00477,completed,partial,2024-04-24T10:56:17.336399
ORD-00000389,24-04-2024,56:17.3,groundnut,Maharashtra,zaid,27.84,5168.46,143880.16,C,processor,BUYER-00272,completed,paid,2024-04-24T10:56:17.336399
ORD-00000390,25-04-2024,56:17.3,mustard,Telangana,zaid,61.89,4212.05,260691.67,B,retailer,BUYER-00359,delivered,partial,2024-04-25T10:56:17.336399
ORD-00000391,25-04-2024,56:17.3,groundnut,Gujarat,zaid,114.05,5562.34,634404.55,C,exporter,BUYER-00689,pending,partial,2024-04-25T10:56:17.336399
ORD-00000392,25-04-2024,56:17.3,soybean,Odisha,zaid,30.51,4303.74,131316.94,A,retailer,BUYER-00670,pending,pending,2024-04-25T10:56:17.336399
ORD-00000393,25-04-2024,56:17.3,mustard,Haryana,zaid,136.64,5110.4,698271.8,B,trader,BUYER-00293,completed,pending,2024-04-25T10:56:17.336399
ORD-00000394,26-04-2024,56:17.3,sesame,Telangana,zaid,62.92,7300.16,459304.5,C,trader,BUYER-00975,pending,partial,2024-04-26T10:56:17.336399
ORD-00000395,26-04-2024,56:17.3,sunflower,Punjab,zaid,53.35,3668.13,195693.18,B,retailer,BUYER-00344,completed,pending,2024-04-26T10:56:17.336399
ORD-00000396,27-04-2024,56:17.3,sesame,Andhra Pradesh,zaid,272.17,7058.37,1921042.34,A,trader,BUYER-00939,delivered,partial,2024-04-27T10:56:17.336399
ORD-00000397,27-04-2024,56:17.3,groundnut,Odisha,zaid,85.64,5952.44,509760.86,C,exporter,BUYER-00319,delivered,pending,2024-04-27T10:56:17.336399
ORD-00000398,27-04-2024,56:17.3,sunflower,Haryana,zaid,79.82,3762.84,300356.26,C,trader,BUYER-00845,delivered,paid,2024-04-27T10:56:17.336399
ORD-00000399,27-04-2024,56:17.3,sesame,Bihar,zaid,158.44,6974.54,1105064.12,C,exporter,BUYER-00772,delivered,pending,2024-04-27T10:56:17.336399
ORD-00000400,28-04-2024,56:17.3,groundnut,Andhra Pradesh,zaid,105.2,5727.01,602505.68,A,trader,BUYER-00310,pending,paid,2024-04-28T10:56:17.336399
ORD-00000401,28-04-2024,56:17.3,sunflower,Uttar Pradesh,zaid,59.52,3814.46,227039.26,C,trader,BUYER-00330,pending,pending,2024-04-28T10:56:17.336399
ORD-00000402,28-04-2024,56:17.3,groundnut,Karnataka,zaid,22.76,5019.18,114237.23,C,trader,BUYER-00937,pending,partial,2024-04-28T10:56:17.336399
ORD-00000403,28-04-2024,56:17.3,sunflower,Rajasthan,zaid,35.35,4118.73,145592.3,A,retailer,BUYER-00774,completed,paid,2024-04-28T10:56:17.336399
ORD-00000404,29-04-2024,56:17.3,sesame,Karnataka,zaid,30.41,7414.75,225495.02,C,retailer,BUYER-00689,completed,paid,2024-04-29T10:56:17.336399
ORD-00000405,29-04-2024,56:17.3,mustard,Telangana,zaid,61.17,4940.07,302208.61,C,exporter,BUYER-00753,completed,partial,2024-04-29T10:56:17.336399
ORD-00000406,30-04-2024,56:17.3,groundnut,Maharashtra,zaid,69.52,5223.79,363135.12,C,retailer,BUYER-00850,delivered,partial,2024-04-30T10:56:17.336399
ORD-00000407,30-04-2024,56:17.3,mustard,Uttar Pradesh,zaid,100.25,4301.61,431218.18,C,retailer,BUYER-00160,delivered,pending,2024-04-30T10:56:17.336399
ORD-00000408,01-05-2024,56:17.3,sunflower,Bihar,zaid,28.99,3485.15,101040.36,A,processor,BUYER-00089,pending,partial,2024-05-01T10:56:17.336399
ORD-00000409,01-05-2024,56:17.3,groundnut,Haryana,zaid,106.45,5324.93,566852.68,C,processor,BUYER-00610,completed,pending,2024-05-01T10:56:17.336399
ORD-00000410,01-05-2024,56:17.3,groundnut,Maharashtra,zaid,133.04,5030.22,669216.64,B,exporter,BUYER-00635,completed,partial,2024-05-01T10:56:17.336399
ORD-00000411,01-05-2024,56:17.3,sunflower,Maharashtra,zaid,33.78,4243.17,143350.9,A,trader,BUYER-00921,pending,partial,2024-05-01T10:56:17.336399
ORD-00000412,02-05-2024,56:17.3,soybean,Telangana,zaid,118.25,4917.85,581528.02,B,exporter,BUYER-00040,pending,partial,2024-05-02T10:56:17.336399
ORD-00000413,02-05-2024,56:17.3,sesame,Uttar Pradesh,zaid,323.76,6958.66,2252927.09,A,exporter,BUYER-00226,delivered,paid,2024-05-02T10:56:17.336399
ORD-00000414,02-05-2024,56:17.3,soybean,Telangana,zaid,75.75,4328.13,327866.54,A,exporter,BUYER-00328,pending,pending,2024-05-02T10:56:17.336399
ORD-00000415,03-05-2024,56:17.3,groundnut,Maharashtra,zaid,156.22,5193.57,811360.95,C,trader,BUYER-00454,delivered,partial,2024-05-03T10:56:17.336399
ORD-00000416,03-05-2024,56:17.3,groundnut,Rajasthan,zaid,170,4590.77,780431.69,C,exporter,BUYER-00796,delivered,partial,2024-05-03T10:56:17.336399
ORD-00000417,03-05-2024,56:17.3,sunflower,Madhya Pradesh,zaid,20.22,4200.38,84940.56,B,processor,BUYER-00040,completed,paid,2024-05-03T10:56:17.336399
ORD-00000418,03-05-2024,56:17.3,mustard,Telangana,zaid,144.93,4823.15,699008.75,A,processor,BUYER-00115,delivered,pending,2024-05-03T10:56:17.336399
ORD-00000419,04-05-2024,56:17.3,groundnut,Uttar Pradesh,zaid,141.26,5452.89,770292.38,B,trader,BUYER-00040,delivered,partial,2024-05-04T10:56:17.336399
ORD-00000420,04-05-2024,56:17.3,sesame,Maharashtra,zaid,197.98,6045.71,1196908.14,B,trader,BUYER-00262,pending,paid,2024-05-04T10:56:17.336399
ORD-00000421,04-05-2024,56:17.3,soybean,Bihar,zaid,81.96,4997.02,409532.22,A,exporter,BUYER-00092,delivered,paid,2024-05-04T10:56:17.336399
ORD-00000422,05-05-2024,56:17.3,mustard,Bihar,zaid,23.19,4310.98,99989.79,C,trader,BUYER-00781,pending,paid,2024-05-05T10:56:17.336399
ORD-00000423,05-05-2024,56:17.3,sunflower,Telangana,zaid,61.44,4025.12,247297.03,C,retailer,BUYER-00170,completed,paid,2024-05-05T10:56:17.336399
ORD-00000424,06-05-2024,56:17.3,mustard,Rajasthan,zaid,120.3,4352.48,523603.77,B,trader,BUYER-00133,delivered,partial,2024-05-06T10:56:17.336399
ORD-00000425,06-05-2024,56:17.3,sesame,Uttar Pradesh,zaid,205.34,7225.09,1483602.77,C,retailer,BUYER-00031,completed,partial,2024-05-06T10:56:17.336399
ORD-00000426,06-05-2024,56:17.3,sesame,Madhya Pradesh,zaid,202.38,5776.3,1168986.14,C,exporter,BUYER-00363,pending,partial,2024-05-06T10:56:17.336399
ORD-00000427,06-05-2024,56:17.3,sunflower,Madhya Pradesh,zaid,29.35,4265.92,125218.45,C,processor,BUYER-00082,completed,partial,2024-05-06T10:56:17.336399
ORD-00000428,07-05-2024,56:17.3,sesame,Karnataka,zaid,169.78,6514.56,1106069.4,C,retailer,BUYER-00295,completed,pending,2024-05-07T10:56:17.336399
ORD-00000429,07-05-2024,56:17.3,sesame,Uttar Pradesh,zaid,94.47,5688.99,537426.26,A,retailer,BUYER-00667,pending,partial,2024-05-07T10:56:17.336399
ORD-00000430,07-05-2024,56:17.3,mustard,Madhya Pradesh,zaid,141.56,4989.81,706366.34,C,exporter,BUYER-00223,completed,pending,2024-05-07T10:56:17.336399
ORD-00000431,08-05-2024,56:17.3,groundnut,Haryana,zaid,140.83,5262.38,741085.2,B,exporter,BUYER-00675,pending,paid,2024-05-08T10:56:17.336399
ORD-00000432,08-05-2024,56:17.3,sesame,Uttar Pradesh,zaid,49.59,6077.52,301377.38,C,trader,BUYER-00455,pending,paid,2024-05-08T10:56:17.336399
ORD-00000433,08-05-2024,56:17.3,mustard,Andhra Pradesh,zaid,100.4,5466.71,548862.6,A,retailer,BUYER-00831,pending,paid,2024-05-08T10:56:17.336399
ORD-00000434,09-05-2024,56:17.3,soybean,Gujarat,zaid,176.03,3963.39,697674.19,B,processor,BUYER-00196,pending,paid,2024-05-09T10:56:17.336399
ORD-00000435,09-05-2024,56:17.3,soybean,Uttar Pradesh,zaid,53.07,4865.65,258221.53,A,trader,BUYER-00324,delivered,paid,2024-05-09T10:56:17.336399
ORD-00000436,09-05-2024,56:17.3,groundnut,Bihar,zaid,47.47,5524.75,262265.35,C,exporter,BUYER-00918,delivered,pending,2024-05-09T10:56:17.336399
ORD-00000437,09-05-2024,56:17.3,mustard,Gujarat,zaid,138.32,4761.95,658679.69,B,processor,BUYER-00022,pending,partial,2024-05-09T10:56:17.336399
ORD-00000438,10-05-2024,56:17.3,sesame,Rajasthan,zaid,36.79,7187.21,264413.77,C,trader,BUYER-00270,completed,paid,2024-05-10T10:56:17.336399
ORD-00000439,10-05-2024,56:17.3,sesame,Gujarat,zaid,244.04,7414.31,1809351.72,C,retailer,BUYER-00676,pending,paid,2024-05-10T10:56:17.336399
ORD-00000440,10-05-2024,56:17.3,soybean,Maharashtra,zaid,133.15,4627.43,616139.07,B,exporter,BUYER-00460,pending,partial,2024-05-10T10:56:17.336399
ORD-00000441,11-05-2024,56:17.3,sesame,Gujarat,zaid,39.77,7126.95,283409.47,C,exporter,BUYER-00879,completed,paid,2024-05-11T10:56:17.336399
ORD-00000442,11-05-2024,56:17.3,mustard,Telangana,zaid,87.44,5189.39,453781.65,A,trader,BUYER-00570,completed,partial,2024-05-11T10:56:17.336399
ORD-00000443,11-05-2024,56:17.3,soybean,Maharashtra,zaid,16,4039.57,64633.07,C,exporter,BUYER-00738,pending,paid,2024-05-11T10:56:17.336399
ORD-00000444,11-05-2024,56:17.3,groundnut,Karnataka,zaid,239.38,5084.84,1217204.04,A,processor,BUYER-00397,pending,paid,2024-05-11T10:56:17.336399
ORD-00000445,12-05-2024,56:17.3,mustard,Punjab,zaid,32.64,5224.53,170520.74,C,processor,BUYER-00157,completed,partial,2024-05-12T10:56:17.336399
ORD-00000446,12-05-2024,56:17.3,soybean,Gujarat,zaid,69.1,4958.93,342665.37,B,retailer,BUYER-00687,pending,paid,2024-05-12T10:56:17.336399
ORD-00000447,13-05-2024,56:17.3,soybean,Rajasthan,zaid,40.53,4002.3,162214.83,C,trader,BUYER-00707,completed,partial,2024-05-13T10:56:17.336399
ORD-00000448,13-05-2024,56:17.3,sesame,Telangana,zaid,172.04,5819.56,1001197,C,trader,BUYER-00604,completed,pending,2024-05-13T10:56:17.336399
ORD-00000449,13-05-2024,56:17.3,groundnut,Bihar,zaid,97.04,5838.86,566616.3,C,retailer,BUYER-00869,delivered,pending,2024-05-13T10:56:17.336399
ORD-00000450,14-05-2024,56:17.3,sunflower,Maharashtra,zaid,100.68,4096.51,412432.73,C,retailer,BUYER-00453,pending,partial,2024-05-14T10:56:17.336399
ORD-00000451,14-05-2024,56:17.3,mustard,Haryana,zaid,155.23,4669.44,724831.87,B,processor,BUYER-00892,delivered,partial,2024-05-14T10:56:17.336399
ORD-00000452,14-05-2024,56:17.3,mustard,Haryana,zaid,118.44,5154.01,610424.48,B,exporter,BUYER-00163,delivered,paid,2024-05-14T10:56:17.336399
ORD-00000453,14-05-2024,56:17.3,sunflower,Gujarat,zaid,24,3972.9,95349.6,A,exporter,BUYER-00524,completed,paid,2024-05-14T10:56:17.336399
ORD-00000454,15-05-2024,56:17.3,sunflower,Odisha,zaid,89.55,3769.46,337547.87,A,exporter,BUYER-00584,completed,partial,2024-05-15T10:56:17.336399
ORD-00000455,15-05-2024,56:17.3,mustard,Gujarat,zaid,36.5,4373.33,159618.55,C,retailer,BUYER-00605,delivered,paid,2024-05-15T10:56:17.336399
ORD-00000456,15-05-2024,56:17.3,sunflower,Karnataka,zaid,79.89,4108.85,328271.37,B,processor,BUYER-00686,delivered,pending,2024-05-15T10:56:17.336399
ORD-00000457,16-05-2024,56:17.3,soybean,Haryana,zaid,98.9,4670.4,461902.87,C,retailer,BUYER-00960,completed,pending,2024-05-16T10:56:17.336399
ORD-00000458,16-05-2024,56:17.3,mustard,Bihar,zaid,35.02,5393.04,188843.43,C,processor,BUYER-00378,completed,paid,2024-05-16T10:56:17.336399
ORD-00000459,16-05-2024,56:17.3,sesame,Odisha,zaid,111.35,7078.25,788145.17,C,retailer,BUYER-00153,delivered,paid,2024-05-16T10:56:17.336399
ORD-00000460,17-05-2024,56:17.3,sunflower,Andhra Pradesh,zaid,24,3372.71,80945.08,A,retailer,BUYER-00236,completed,partial,2024-05-17T10:56:17.336399
ORD-00000461,17-05-2024,56:17.3,soybean,Odisha,zaid,41.16,4578.86,188443.83,B,retailer,BUYER-00944,pending,partial,2024-05-17T10:56:17.336399
ORD-00000462,17-05-2024,56:17.3,groundnut,Gujarat,zaid,162.73,4520.17,735568.99,A,trader,BUYER-00501,delivered,pending,2024-05-17T10:56:17.336399
ORD-00000463,18-05-2024,56:17.3,mustard,Haryana,zaid,79.54,4703.88,374127.1,C,trader,BUYER-00064,delivered,pending,2024-05-18T10:56:17.336399
ORD-00000464,18-05-2024,56:17.3,sunflower,Haryana,zaid,53.52,3243.25,173573.1,B,exporter,BUYER-00274,completed,partial,2024-05-18T10:56:17.336399
ORD-00000465,19-05-2024,56:17.3,mustard,Telangana,zaid,73.43,4771.11,350321.57,A,trader,BUYER-00607,delivered,pending,2024-05-19T10:56:17.336399
ORD-00000466,19-05-2024,56:17.3,soybean,Punjab,zaid,148.44,4711.93,699440.39,A,retailer,BUYER-00729,completed,pending,2024-05-19T10:56:17.336399
ORD-00000467,19-05-2024,56:17.3,sesame,Punjab,zaid,192.3,7045.71,1354919.76,C,exporter,BUYER-00392,delivered,paid,2024-05-19T10:56:17.336399
ORD-00000468,20-05-2024,56:17.3,groundnut,Telangana,zaid,115.01,4583.69,527172.83,A,exporter,BUYER-00401,pending,paid,2024-05-20T10:56:17.336399
ORD-00000469,20-05-2024,56:17.3,mustard,Haryana,zaid,24.26,4902.1,118908.63,C,trader,BUYER-00463,delivered,pending,2024-05-20T10:56:17.336399
ORD-00000470,20-05-2024,56:17.3,mustard,Uttar Pradesh,zaid,113.64,4970.14,564821.42,A,trader,BUYER-00660,completed,paid,2024-05-20T10:56:17.336399
ORD-00000471,20-05-2024,56:17.3,sesame,Uttar Pradesh,zaid,141.94,7037.82,998935,A,processor,BUYER-00242,pending,paid,2024-05-20T10:56:17.336399
ORD-00000472,21-05-2024,56:17.3,soybean,Bihar,zaid,81.5,3943.62,321386.99,A,processor,BUYER-00973,delivered,paid,2024-05-21T10:56:17.336399
ORD-00000473,21-05-2024,56:17.3,groundnut,Madhya Pradesh,zaid,33.46,5706.24,190916.44,C,retailer,BUYER-00666,completed,paid,2024-05-21T10:56:17.336399
ORD-00000474,22-05-2024,56:17.3,sesame,Uttar Pradesh,zaid,112.09,7431.06,832962.35,B,processor,BUYER-00090,pending,partial,2024-05-22T10:56:17.336399
ORD-00000475,22-05-2024,56:17.3,sesame,Uttar Pradesh,zaid,165.72,7086.14,1174310.47,C,exporter,BUYER-00994,completed,paid,2024-05-22T10:56:17.336399
ORD-00000476,22-05-2024,56:17.3,sesame,Haryana,zaid,35.98,6832.25,245821.69,B,processor,BUYER-00872,completed,partial,2024-05-22T10:56:17.336399
ORD-00000477,23-05-2024,56:17.3,sunflower,Haryana,zaid,22.24,4251.69,94552.48,B,processor,BUYER-00009,pending,partial,2024-05-23T10:56:17.336399
ORD-00000478,23-05-2024,56:17.3,mustard,Rajasthan,zaid,186.63,4154.84,775430.09,A,processor,BUYER-00416,pending,paid,2024-05-23T10:56:17.336399
ORD-00000479,23-05-2024,56:17.3,groundnut,Karnataka,zaid,59.03,5878.91,347046.26,C,trader,BUYER-00840,delivered,pending,2024-05-23T10:56:17.336399
ORD-00000480,23-05-2024,56:17.3,mustard,Madhya Pradesh,zaid,133.68,5234.49,699757.32,B,exporter,BUYER-00318,delivered,partial,2024-05-23T10:56:17.336399
ORD-00000481,24-05-2024,56:17.3,groundnut,Odisha,zaid,170,4544.98,772655.05,A,trader,BUYER-00084,pending,paid,2024-05-24T10:56:17.336399
ORD-00000482,24-05-2024,56:17.3,soybean,Madhya Pradesh,zaid,107.59,4631.59,498295.59,B,exporter,BUYER-00022,delivered,partial,2024-05-24T10:56:17.336399
ORD-00000483,24-05-2024,56:17.3,mustard,Maharashtra,zaid,79.11,5006.75,396061.55,C,processor,BUYER-00809,pending,paid,2024-05-24T10:56:17.336399
ORD-00000484,24-05-2024,56:17.3,soybean,Uttar Pradesh,zaid,42.71,4417.12,188659.25,B,trader,BUYER-00978,pending,paid,2024-05-24T10:56:17.336399
ORD-00000485,25-05-2024,56:17.3,sesame,Maharashtra,zaid,247.24,6793.07,1679525,A,retailer,BUYER-00537,pending,partial,2024-05-25T10:56:17.336399
ORD-00000486,25-05-2024,56:17.3,mustard,Andhra Pradesh,zaid,151.27,4395.67,664921.69,A,processor,BUYER-00567,pending,pending,2024-05-25T10:56:17.336399
ORD-00000487,25-05-2024,56:17.3,sesame,Punjab,zaid,115.1,6976.34,802950.38,C,processor,BUYER-00733,completed,pending,2024-05-25T10:56:17.336399
ORD-00000488,26-05-2024,56:17.3,soybean,Karnataka,zaid,58.83,3883.94,228510.93,C,retailer,BUYER-00812,pending,pending,2024-05-26T10:56:17.336399
ORD-00000489,26-05-2024,56:17.3,soybean,Andhra Pradesh,zaid,102.57,4795.92,491919.92,A,retailer,BUYER-00662,pending,pending,2024-05-26T10:56:17.336399
ORD-00000490,26-05-2024,56:17.3,sesame,Telangana,zaid,89.79,6582.83,591097.04,B,retailer,BUYER-00059,pending,partial,2024-05-26T10:56:17.336399
ORD-00000491,26-05-2024,56:17.3,soybean,Haryana,zaid,86.35,4094.38,353537.35,C,trader,BUYER-00035,completed,paid,2024-05-26T10:56:17.336399
ORD-00000492,27-05-2024,56:17.3,mustard,Karnataka,zaid,29.7,4124.14,122471.04,A,trader,BUYER-00353,pending,partial,2024-05-27T10:56:17.336399
ORD-00000493,27-05-2024,56:17.3,sesame,Gujarat,zaid,267.63,5864.68,1569547.32,B,processor,BUYER-00725,pending,pending,2024-05-27T10:56:17.336399
ORD-00000494,28-05-2024,56:17.3,mustard,Uttar Pradesh,zaid,98.18,5298.59,520234.65,A,trader,BUYER-00805,pending,pending,2024-05-28T10:56:17.336399
ORD-00000495,28-05-2024,56:17.3,mustard,Rajasthan,zaid,54.3,4614.3,250542.78,C,exporter,BUYER-00532,completed,partial,2024-05-28T10:56:17.336399
ORD-00000496,28-05-2024,56:17.3,sunflower,Karnataka,zaid,44.35,3849.36,170714.73,C,processor,BUYER-00947,completed,pending,2024-05-28T10:56:17.336399
ORD-00000497,28-05-2024,56:17.3,groundnut,Gujarat,zaid,124.16,5104.24,633750.48,C,retailer,BUYER-00117,pending,pending,2024-05-28T10:56:17.336399
ORD-00000498,29-05-2024,56:17.3,sunflower,Telangana,zaid,58.1,4225.7,245531.15,A,processor,BUYER-00418,completed,pending,2024-05-29T10:56:17.336399
ORD-00000499,29-05-2024,56:17.3,mustard,Telangana,zaid,109.84,5023.21,551770.69,B,processor,BUYER-00755,completed,paid,2024-05-29T10:56:17.336399
ORD-00000500,29-05-2024,56:17.3,groundnut,Gujarat,zaid,158.28,5843.29,924868.57,B,exporter,BUYER-00268,completed,paid,2024-05-29T10:56:17.336399
ORD-00000501,30-05-2024,56:17.3,soybean,Telangana,zaid,71.35,4677.61,333758.21,C,processor,BUYER-00911,pending,partial,2024-05-30T10:56:17.336399
ORD-00000502,30-05-2024,56:17.3,sunflower,Gujarat,zaid,46.83,4114.64,192696.55,A,trader,BUYER-00100,delivered,pending,2024-05-30T10:56:17.336399
ORD-00000503,30-05-2024,56:17.3,soybean,Odisha,zaid,93.65,4067.57,380924.82,C,retailer,BUYER-00940,pending,partial,2024-05-30T10:56:17.336399
ORD-00000504,30-05-2024,56:17.3,groundnut,Bihar,zaid,69.69,5219.68,363760.54,B,retailer,BUYER-00293,completed,pending,2024-05-30T10:56:17.336399
ORD-00000505,31-05-2024,56:17.3,sunflower,Andhra Pradesh,zaid,20,3728.37,74567.37,B,retailer,BUYER-00502,completed,paid,2024-05-31T10:56:17.336399
ORD-00000506,31-05-2024,56:17.3,mustard,Andhra Pradesh,zaid,125.92,4721.24,594515.84,B,trader,BUYER-00504,delivered,paid,2024-05-31T10:56:17.336399
ORD-00000507,01-06-2024,56:17.3,sunflower,Andhra Pradesh,kharif,289.54,3905.96,1130948.67,A,exporter,BUYER-00838,pending,partial,2024-06-01T10:56:17.336399
ORD-00000508,01-06-2024,56:17.3,groundnut,Uttar Pradesh,kharif,379.17,4906.95,1860592.29,A,retailer,BUYER-00028,delivered,paid,2024-06-01T10:56:17.336399
ORD-00000509,01-06-2024,56:17.3,mustard,Telangana,kharif,59.82,5025.7,300625.44,C,exporter,BUYER-00449,delivered,pending,2024-06-01T10:56:17.336399
ORD-00000510,01-06-2024,56:17.3,sunflower,Gujarat,kharif,477.68,3379.2,1614159.09,C,retailer,BUYER-00301,delivered,pending,2024-06-01T10:56:17.336399
ORD-00000511,02-06-2024,56:17.3,sesame,Odisha,kharif,285.22,5985.3,1707116.87,A,exporter,BUYER-00707,delivered,paid,2024-06-02T10:56:17.336399
ORD-00000512,02-06-2024,56:17.3,mustard,Telangana,kharif,112.01,4556.48,510371.11,B,exporter,BUYER-00605,pending,paid,2024-06-02T10:56:17.336399
ORD-00000513,02-06-2024,56:17.3,sunflower,Gujarat,kharif,302.48,4174.93,1262820.01,B,exporter,BUYER-00257,delivered,paid,2024-06-02T10:56:17.336399
ORD-00000514,02-06-2024,56:17.3,sesame,Karnataka,kharif,221.98,6671.37,1480883.69,C,retailer,BUYER-00972,pending,partial,2024-06-02T10:56:17.336399
ORD-00000515,03-06-2024,56:17.3,soybean,Odisha,kharif,194.73,4309.99,839278.15,B,retailer,BUYER-00284,delivered,pending,2024-06-03T10:56:17.336399
ORD-00000516,03-06-2024,56:17.3,soybean,Gujarat,kharif,93.1,4819.14,448676.64,C,exporter,BUYER-00997,completed,partial,2024-06-03T10:56:17.336399
ORD-00000517,04-06-2024,56:17.3,sunflower,Karnataka,kharif,482.17,4034.14,1945128.08,B,retailer,BUYER-00824,pending,pending,2024-06-04T10:56:17.336399
ORD-00000518,04-06-2024,56:17.3,mustard,Madhya Pradesh,kharif,188.05,5330.31,1002341.88,B,exporter,BUYER-00620,pending,pending,2024-06-04T10:56:17.336399
ORD-00000519,05-06-2024,56:17.3,sesame,Haryana,kharif,92.74,6051.01,561147.7,C,exporter,BUYER-00642,pending,paid,2024-06-05T10:56:17.336399
ORD-00000520,05-06-2024,56:17.3,sunflower,Odisha,kharif,85.95,3493.49,300282.45,C,processor,BUYER-00282,completed,paid,2024-06-05T10:56:17.336399
ORD-00000521,05-06-2024,56:17.3,sunflower,Rajasthan,kharif,71.5,3369.21,240884.87,C,processor,BUYER-00198,pending,partial,2024-06-05T10:56:17.336399
ORD-00000522,05-06-2024,56:17.3,mustard,Telangana,kharif,58.95,4207.52,248042.2,B,processor,BUYER-00161,completed,paid,2024-06-05T10:56:17.336399
ORD-00000523,06-06-2024,56:17.3,sunflower,Karnataka,kharif,300.58,4014.56,1206686.47,C,retailer,BUYER-00276,delivered,pending,2024-06-06T10:56:17.336399
ORD-00000524,06-06-2024,56:17.3,mustard,Uttar Pradesh,kharif,227.23,5469.77,1242909.37,C,retailer,BUYER-00811,delivered,paid,2024-06-06T10:56:17.336399
ORD-00000525,07-06-2024,56:17.3,mustard,Madhya Pradesh,kharif,286.99,5000.33,1435041.39,B,exporter,BUYER-00185,completed,paid,2024-06-07T10:56:17.336399
ORD-00000526,07-06-2024,56:17.3,groundnut,Telangana,kharif,223.96,4816.59,1078706.05,B,trader,BUYER-00427,delivered,paid,2024-06-07T10:56:17.336399
ORD-00000527,07-06-2024,56:17.3,sesame,Uttar Pradesh,kharif,341.53,6825.39,2331045.97,B,exporter,BUYER-00852,completed,pending,2024-06-07T10:56:17.336399
ORD-00000528,08-06-2024,56:17.3,mustard,Telangana,kharif,34.28,4523.42,155079.01,A,trader,BUYER-00336,completed,partial,2024-06-08T10:56:17.336399
ORD-00000529,08-06-2024,56:17.3,soybean,Maharashtra,kharif,860.71,4814.41,4143825.48,B,processor,BUYER-00008,pending,paid,2024-06-08T10:56:17.336399
ORD-00000530,08-06-2024,56:17.3,groundnut,Haryana,kharif,490.35,4566.49,2239185.59,A,retailer,BUYER-00776,delivered,partial,2024-06-08T10:56:17.336399
ORD-00000531,08-06-2024,56:17.3,mustard,Uttar Pradesh,kharif,82.99,4417.77,366625.61,A,exporter,BUYER-00495,pending,paid,2024-06-08T10:56:17.336399
ORD-00000532,09-06-2024,56:17.3,groundnut,Bihar,kharif,84.42,5452.15,460284.51,C,exporter,BUYER-00119,delivered,paid,2024-06-09T10:56:17.336399
ORD-00000533,09-06-2024,56:17.3,sesame,Karnataka,kharif,522.58,6857.33,3583533.12,B,exporter,BUYER-00114,delivered,paid,2024-06-09T10:56:17.336399
ORD-00000534,09-06-2024,56:17.3,groundnut,Karnataka,kharif,127.89,5716.17,731058.07,B,processor,BUYER-00303,pending,paid,2024-06-09T10:56:17.336399
ORD-00000535,10-06-2024,56:17.3,sesame,Rajasthan,kharif,77.05,7340.35,565542.8,B,trader,BUYER-00814,completed,pending,2024-06-10T10:56:17.336399
ORD-00000536,10-06-2024,56:17.3,soybean,Andhra Pradesh,kharif,493.06,4635.82,2285752.41,C,exporter,BUYER-00287,pending,partial,2024-06-10T10:56:17.336399
ORD-00000537,11-06-2024,56:17.3,sunflower,Punjab,kharif,299.96,3972.41,1191544.74,B,exporter,BUYER-00602,pending,paid,2024-06-11T10:56:17.336399
ORD-00000538,11-06-2024,56:17.3,sunflower,Telangana,kharif,223.41,3411.59,762171.9,B,retailer,BUYER-00704,pending,partial,2024-06-11T10:56:17.336399
ORD-00000539,11-06-2024,56:17.3,sunflower,Punjab,kharif,75.71,4343.98,328884.19,C,processor,BUYER-00681,pending,paid,2024-06-11T10:56:17.336399
ORD-00000540,12-06-2024,56:17.3,sunflower,Madhya Pradesh,kharif,763.5,4121.92,3147076.78,A,trader,BUYER-00589,completed,paid,2024-06-12T10:56:17.336399
ORD-00000541,12-06-2024,56:17.3,sunflower,Odisha,kharif,220.21,3354.38,738662.49,A,exporter,BUYER-00610,delivered,partial,2024-06-12T10:56:17.336399
ORD-00000542,13-06-2024,56:17.3,groundnut,Punjab,kharif,347.02,5864.05,2034917.68,B,exporter,BUYER-00019,completed,pending,2024-06-13T10:56:17.336399
ORD-00000543,13-06-2024,56:17.3,sesame,Odisha,kharif,309.32,7011.46,2168790.19,C,retailer,BUYER-00279,pending,paid,2024-06-13T10:56:17.336399
ORD-00000544,14-06-2024,56:17.3,mustard,Andhra Pradesh,kharif,251.37,4620.97,1161586.65,A,retailer,BUYER-00822,delivered,pending,2024-06-14T10:56:17.336399
ORD-00000545,14-06-2024,56:17.3,sesame,Maharashtra,kharif,489.18,6165.34,3015959.86,B,processor,BUYER-00065,delivered,paid,2024-06-14T10:56:17.336399
ORD-00000546,14-06-2024,56:17.3,groundnut,Gujarat,kharif,171.93,5038.03,866169.01,C,exporter,BUYER-00917,delivered,partial,2024-06-14T10:56:17.336399
ORD-00000547,14-06-2024,56:17.3,mustard,Gujarat,kharif,110.59,4869.84,538577.15,C,exporter,BUYER-00417,delivered,paid,2024-06-14T10:56:17.336399
ORD-00000548,15-06-2024,56:17.3,soybean,Punjab,kharif,546.19,4424.97,2416886.55,A,retailer,BUYER-00102,delivered,paid,2024-06-15T10:56:17.336399
ORD-00000549,15-06-2024,56:17.3,sunflower,Karnataka,kharif,79.62,3917.93,311948.2,C,trader,BUYER-00622,completed,pending,2024-06-15T10:56:17.336399
ORD-00000550,16-06-2024,56:17.3,sesame,Odisha,kharif,307.4,6428.81,1976220.85,B,processor,BUYER-00003,pending,paid,2024-06-16T10:56:17.336399
ORD-00000551,16-06-2024,56:17.3,sunflower,Haryana,kharif,370.52,4314.69,1598678.15,B,processor,BUYER-00450,pending,pending,2024-06-16T10:56:17.336399
ORD-00000552,16-06-2024,56:17.3,sesame,Karnataka,kharif,292.2,5575,1628987.88,B,processor,BUYER-00154,pending,partial,2024-06-16T10:56:17.336399
ORD-00000553,17-06-2024,56:17.3,groundnut,Andhra Pradesh,kharif,201.63,5042.16,1016662.94,A,exporter,BUYER-00293,delivered,pending,2024-06-17T10:56:17.336399
ORD-00000554,17-06-2024,56:17.3,soybean,Uttar Pradesh,kharif,310.53,4468.54,1387628.61,A,retailer,BUYER-00043,completed,partial,2024-06-17T10:56:17.336399
ORD-00000555,18-06-2024,56:17.3,sesame,Odisha,kharif,388.81,6925.34,2692667.41,B,exporter,BUYER-00891,completed,partial,2024-06-18T10:56:17.336399
ORD-00000556,18-06-2024,56:17.3,groundnut,Karnataka,kharif,273.17,5702.93,1557888.34,A,processor,BUYER-00619,pending,pending,2024-06-18T10:56:17.336399
ORD-00000557,18-06-2024,56:17.3,sesame,Andhra Pradesh,kharif,44.65,6787.58,303032.36,C,retailer,BUYER-00124,delivered,partial,2024-06-18T10:56:17.336399
ORD-00000558,18-06-2024,56:17.3,sunflower,Andhra Pradesh,kharif,437.39,3976.35,1739225.62,C,trader,BUYER-00051,pending,partial,2024-06-18T10:56:17.336399
ORD-00000559,19-06-2024,56:17.3,soybean,Rajasthan,kharif,213.63,4471.9,955321.64,B,processor,BUYER-00787,delivered,partial,2024-06-19T10:56:17.336399
ORD-00000560,19-06-2024,56:17.3,groundnut,Odisha,kharif,78.04,5177.96,404096.94,A,retailer,BUYER-00373,completed,partial,2024-06-19T10:56:17.336399
ORD-00000561,19-06-2024,56:17.3,sunflower,Karnataka,kharif,171.07,3580.31,612466.16,C,exporter,BUYER-00751,delivered,paid,2024-06-19T10:56:17.336399
ORD-00000562,19-06-2024,56:17.3,sesame,Bihar,kharif,254.78,6657.82,1696245.75,B,exporter,BUYER-00106,delivered,pending,2024-06-19T10:56:17.336399
ORD-00000563,20-06-2024,56:17.3,soybean,Bihar,kharif,500.33,4193.04,2097896.22,A,exporter,BUYER-00644,pending,partial,2024-06-20T10:56:17.336399
ORD-00000564,20-06-2024,56:17.3,sunflower,Odisha,kharif,428.84,3825.63,1640570.51,B,exporter,BUYER-00263,delivered,pending,2024-06-20T10:56:17.336399
ORD-00000565,20-06-2024,56:17.3,sesame,Maharashtra,kharif,407.84,5878.8,2397608.63,C,processor,BUYER-00909,pending,pending,2024-06-20T10:56:17.336399
ORD-00000566,21-06-2024,56:17.3,sunflower,Madhya Pradesh,kharif,425.17,3351.84,1425100.28,C,exporter,BUYER-00938,completed,pending,2024-06-21T10:56:17.336399
ORD-00000567,21-06-2024,56:17.3,groundnut,Uttar Pradesh,kharif,122.68,5851.69,717912.59,B,trader,BUYER-00084,delivered,pending,2024-06-21T10:56:17.336399
ORD-00000568,21-06-2024,56:17.3,sesame,Punjab,kharif,388.55,7096.69,2757408.1,A,exporter,BUYER-00385,delivered,partial,2024-06-21T10:56:17.336399
ORD-00000569,21-06-2024,56:17.3,soybean,Maharashtra,kharif,476.29,4535.77,2160322.51,A,exporter,BUYER-00559,completed,paid,2024-06-21T10:56:17.336399
ORD-00000570,22-06-2024,56:17.3,groundnut,Uttar Pradesh,kharif,47.07,5415.26,254894.96,B,processor,BUYER-00277,delivered,paid,2024-06-22T10:56:17.336399
ORD-00000571,22-06-2024,56:17.3,groundnut,Bihar,kharif,286.65,4775.8,1368991.32,B,retailer,BUYER-00521,delivered,paid,2024-06-22T10:56:17.336399
ORD-00000572,22-06-2024,56:17.3,sunflower,Andhra Pradesh,kharif,466.45,3429.24,1599571.86,A,trader,BUYER-00633,pending,partial,2024-06-22T10:56:17.336399
ORD-00000573,22-06-2024,56:17.3,groundnut,Maharashtra,kharif,445.06,5824.04,2592016.9,B,trader,BUYER-00720,pending,partial,2024-06-22T10:56:17.336399
ORD-00000574,23-06-2024,56:17.3,groundnut,Gujarat,kharif,125.27,5637.62,706243.81,C,processor,BUYER-00050,pending,paid,2024-06-23T10:56:17.336399
ORD-00000575,23-06-2024,56:17.3,soybean,Karnataka,kharif,531.13,4974.09,2641903.72,B,processor,BUYER-00167,completed,partial,2024-06-23T10:56:17.336399
ORD-00000576,24-06-2024,56:17.3,groundnut,Haryana,kharif,278.4,5615.98,1563500.3,C,exporter,BUYER-00970,completed,paid,2024-06-24T10:56:17.336399
ORD-00000577,24-06-2024,56:17.3,sunflower,Madhya Pradesh,kharif,364.75,3898.73,1422045.38,B,retailer,BUYER-00687,delivered,paid,2024-06-24T10:56:17.336399
ORD-00000578,24-06-2024,56:17.3,groundnut,Gujarat,kharif,187.03,5776.05,1080277.62,A,processor,BUYER-00673,completed,pending,2024-06-24T10:56:17.336399
ORD-00000579,25-06-2024,56:17.3,sunflower,Andhra Pradesh,kharif,397.97,3433.43,1366389.3,A,exporter,BUYER-00805,completed,partial,2024-06-25T10:56:17.336399
ORD-00000580,25-06-2024,56:17.3,groundnut,Madhya Pradesh,kharif,260.27,5367.07,1396861.5,C,processor,BUYER-00160,pending,partial,2024-06-25T10:56:17.336399
ORD-00000581,25-06-2024,56:17.3,groundnut,Uttar Pradesh,kharif,310.12,4820.74,1494987.12,B,retailer,BUYER-00077,pending,partial,2024-06-25T10:56:17.336399
ORD-00000582,25-06-2024,56:17.3,groundnut,Gujarat,kharif,254.01,5194.96,1319578.54,C,exporter,BUYER-00770,completed,paid,2024-06-25T10:56:17.336399
ORD-00000583,26-06-2024,56:17.3,soybean,Rajasthan,kharif,588.9,4737.39,2789866.4,A,exporter,BUYER-00554,delivered,pending,2024-06-26T10:56:17.336399
ORD-00000584,26-06-2024,56:17.3,sunflower,Rajasthan,kharif,384.42,4048.06,1556158.56,A,trader,BUYER-00753,pending,paid,2024-06-26T10:56:17.336399
ORD-00000585,26-06-2024,56:17.3,groundnut,Haryana,kharif,38.38,4952.1,190082.9,C,trader,BUYER-00302,pending,paid,2024-06-26T10:56:17.336399
ORD-00000586,26-06-2024,56:17.3,sunflower,Karnataka,kharif,92.98,4055.75,377084.5,C,retailer,BUYER-00554,pending,pending,2024-06-26T10:56:17.336399
ORD-00000587,27-06-2024,56:17.3,sunflower,Bihar,kharif,458.13,3531.98,1618097.97,A,retailer,BUYER-00741,delivered,pending,2024-06-27T10:56:17.336399
ORD-00000588,27-06-2024,56:17.3,soybean,Karnataka,kharif,633.34,4084.02,2586574.81,B,processor,BUYER-00648,pending,paid,2024-06-27T10:56:17.336399
ORD-00000589,27-06-2024,56:17.3,sunflower,Telangana,kharif,278.81,3621.66,1009750.33,A,exporter,BUYER-00999,pending,pending,2024-06-27T10:56:17.336399
ORD-00000590,27-06-2024,56:17.3,sunflower,Haryana,kharif,81.89,3821.73,312963.82,C,retailer,BUYER-00642,delivered,paid,2024-06-27T10:56:17.336399
ORD-00000591,28-06-2024,56:17.3,soybean,Punjab,kharif,150.56,4689.23,705987.16,A,processor,BUYER-00776,delivered,paid,2024-06-28T10:56:17.336399
ORD-00000592,28-06-2024,56:17.3,soybean,Maharashtra,kharif,811.78,4703.68,3818379.41,B,trader,BUYER-00812,pending,partial,2024-06-28T10:56:17.336399
ORD-00000593,29-06-2024,56:17.3,sesame,Gujarat,kharif,351.43,5896.13,2072085.78,B,exporter,BUYER-00130,completed,partial,2024-06-29T10:56:17.336399
ORD-00000594,29-06-2024,56:17.3,sesame,Haryana,kharif,459.56,6815.59,3132192.34,C,retailer,BUYER-00209,delivered,paid,2024-06-29T10:56:17.336399
ORD-00000595,30-06-2024,56:17.3,sunflower,Madhya Pradesh,kharif,436.37,3760.33,1640894.21,C,retailer,BUYER-00264,completed,partial,2024-06-30T10:56:17.336399
ORD-00000596,30-06-2024,56:17.3,sunflower,Gujarat,kharif,373.46,3331.19,1244056.37,C,processor,BUYER-00453,delivered,partial,2024-06-30T10:56:17.336399
ORD-00000597,30-06-2024,56:17.3,mustard,Odisha,kharif,65.73,5073.61,333498.47,A,processor,BUYER-00311,completed,paid,2024-06-30T10:56:17.336399
ORD-00000598,30-06-2024,56:17.3,mustard,Madhya Pradesh,kharif,174.67,4219.21,736984.79,B,processor,BUYER-00633,delivered,partial,2024-06-30T10:56:17.336399
ORD-00000599,01-07-2024,56:17.3,groundnut,Madhya Pradesh,kharif,449.6,4962.21,2230985.86,A,retailer,BUYER-00908,pending,paid,2024-07-01T10:56:17.336399
ORD-00000600,01-07-2024,56:17.3,groundnut,Uttar Pradesh,kharif,452.23,5160.82,2333888.58,B,trader,BUYER-00542,completed,pending,2024-07-01T10:56:17.336399
ORD-00000601,01-07-2024,56:17.3,groundnut,Odisha,kharif,105.8,5042.93,533544.7,B,processor,BUYER-00104,completed,pending,2024-07-01T10:56:17.336399
ORD-00000602,01-07-2024,56:17.3,mustard,Andhra Pradesh,kharif,22.42,5141.54,115296.49,C,processor,BUYER-00248,delivered,partial,2024-07-01T10:56:17.336399
ORD-00000603,02-07-2024,56:17.3,sesame,Bihar,kharif,452.93,6540.87,2962582.98,A,exporter,BUYER-00966,delivered,partial,2024-07-02T10:56:17.336399
ORD-00000604,02-07-2024,56:17.3,sunflower,Maharashtra,kharif,258.45,4128.21,1066923.79,B,retailer,BUYER-00800,delivered,paid,2024-07-02T10:56:17.336399
ORD-00000605,03-07-2024,56:17.3,sunflower,Madhya Pradesh,kharif,373.04,3807.8,1420457.7,C,processor,BUYER-00500,completed,partial,2024-07-03T10:56:17.336399
ORD-00000606,03-07-2024,56:17.3,sesame,Maharashtra,kharif,633.09,5595.51,3542478.02,A,processor,BUYER-00481,completed,paid,2024-07-03T10:56:17.336399
ORD-00000607,04-07-2024,56:17.3,mustard,Telangana,kharif,75.78,4598.6,348483,B,retailer,BUYER-00341,completed,paid,2024-07-04T10:56:17.336399
ORD-00000608,04-07-2024,56:17.3,sesame,Odisha,kharif,153.97,5991.16,922470.01,C,exporter,BUYER-00449,completed,pending,2024-07-04T10:56:17.336399
ORD-00000609,04-07-2024,56:17.3,groundnut,Gujarat,kharif,149.99,5039.29,755836.99,C,trader,BUYER-00407,delivered,paid,2024-07-04T10:56:17.336399
ORD-00000610,04-07-2024,56:17.3,sesame,Telangana,kharif,563.2,7228.01,4070813.98,A,processor,BUYER-00262,completed,paid,2024-07-04T10:56:17.336399
ORD-00000611,05-07-2024,56:17.3,sesame,Maharashtra,kharif,577.47,6645.45,3837535.9,B,processor,BUYER-00316,delivered,pending,2024-07-05T10:56:17.336399
ORD-00000612,05-07-2024,56:17.3,sunflower,Telangana,kharif,561.35,3467.7,1946598.1,A,exporter,BUYER-00239,completed,pending,2024-07-05T10:56:17.336399
ORD-00000613,05-07-2024,56:17.3,groundnut,Andhra Pradesh,kharif,139.07,5261.98,731774.03,C,trader,BUYER-00429,pending,partial,2024-07-05T10:56:17.336399
ORD-00000614,05-07-2024,56:17.3,groundnut,Uttar Pradesh,kharif,203.58,5789.64,1178643.57,B,exporter,BUYER-00670,completed,partial,2024-07-05T10:56:17.336399
ORD-00000615,06-07-2024,56:17.3,sesame,Karnataka,kharif,544.72,7065.56,3848749.28,A,processor,BUYER-00948,delivered,paid,2024-07-06T10:56:17.336399
ORD-00000616,06-07-2024,56:17.3,groundnut,Haryana,kharif,351.48,4923.14,1730395.55,B,processor,BUYER-00675,delivered,paid,2024-07-06T10:56:17.336399
ORD-00000617,06-07-2024,56:17.3,mustard,Odisha,kharif,43.55,5080.73,221261.97,C,trader,BUYER-00466,completed,paid,2024-07-06T10:56:17.336399
ORD-00000618,07-07-2024,56:17.3,sesame,Karnataka,kharif,537.93,6774.9,3644399.57,B,exporter,BUYER-00537,completed,paid,2024-07-07T10:56:17.336399
ORD-00000619,07-07-2024,56:17.3,sunflower,Madhya Pradesh,kharif,533.65,3776.46,2015298.8,A,retailer,BUYER-00289,pending,pending,2024-07-07T10:56:17.336399
ORD-00000620,07-07-2024,56:17.3,sunflower,Uttar Pradesh,kharif,513.63,3785.25,1944202.26,C,processor,BUYER-00110,pending,paid,2024-07-07T10:56:17.336399
ORD-00000621,08-07-2024,56:17.3,sesame,Rajasthan,kharif,409.66,6144.19,2517010.14,C,exporter,BUYER-00483,completed,partial,2024-07-08T10:56:17.336399
ORD-00000622,08-07-2024,56:17.3,sesame,Maharashtra,kharif,328.04,5810.43,1906051.24,B,retailer,BUYER-00117,completed,pending,2024-07-08T10:56:17.336399
ORD-00000623,08-07-2024,56:17.3,sunflower,Telangana,kharif,113.18,3775.19,427261.63,B,trader,BUYER-00964,delivered,pending,2024-07-08T10:56:17.336399
ORD-00000624,09-07-2024,56:17.3,sunflower,Karnataka,kharif,222.69,3321.16,739600.14,A,retailer,BUYER-00012,completed,partial,2024-07-09T10:56:17.336399
ORD-00000625,09-07-2024,56:17.3,soybean,Rajasthan,kharif,895.58,4408.87,3948487.61,A,retailer,BUYER-00653,delivered,pending,2024-07-09T10:56:17.336399
ORD-00000626,10-07-2024,56:17.3,sunflower,Gujarat,kharif,499.97,3731.04,1865428.05,A,trader,BUYER-00828,completed,pending,2024-07-10T10:56:17.336399
ORD-00000627,10-07-2024,56:17.3,sunflower,Uttar Pradesh,kharif,597.75,3230.38,1930957.8,B,processor,BUYER-00043,completed,paid,2024-07-10T10:56:17.336399
ORD-00000628,10-07-2024,56:17.3,sunflower,Odisha,kharif,268.31,3971.23,1065531.23,C,processor,BUYER-00467,completed,pending,2024-07-10T10:56:17.336399
ORD-00000629,10-07-2024,56:17.3,groundnut,Madhya Pradesh,kharif,171.96,5300.53,911483.41,C,retailer,BUYER-00930,delivered,pending,2024-07-10T10:56:17.336399
ORD-00000630,11-07-2024,56:17.3,sesame,Maharashtra,kharif,166.21,6469.97,1075384.93,C,trader,BUYER-00690,delivered,paid,2024-07-11T10:56:17.336399
ORD-00000631,11-07-2024,56:17.3,soybean,Gujarat,kharif,133,4763.3,633529.02,B,retailer,BUYER-00457,completed,pending,2024-07-11T10:56:17.336399
ORD-00000632,11-07-2024,56:17.3,soybean,Rajasthan,kharif,450.27,4055.4,1826017.3,A,processor,BUYER-00149,completed,paid,2024-07-11T10:56:17.336399
ORD-00000633,12-07-2024,56:17.3,groundnut,Karnataka,kharif,321.77,4834,1555440.36,B,trader,BUYER-00263,pending,partial,2024-07-12T10:56:17.336399
ORD-00000634,12-07-2024,56:17.3,soybean,Punjab,kharif,445.33,3909.09,1740853.4,C,trader,BUYER-00260,completed,paid,2024-07-12T10:56:17.336399
ORD-00000635,13-07-2024,56:17.3,soybean,Karnataka,kharif,171.36,4139.07,709283.21,C,exporter,BUYER-00380,completed,paid,2024-07-13T10:56:17.336399
ORD-00000636,13-07-2024,56:17.3,sunflower,Madhya Pradesh,kharif,324.54,3941.24,1279101.53,A,exporter,BUYER-00124,completed,paid,2024-07-13T10:56:17.336399
ORD-00000637,13-07-2024,56:17.3,sesame,Gujarat,kharif,474.77,6937.42,3293663.63,C,exporter,BUYER-00485,delivered,paid,2024-07-13T10:56:17.336399
ORD-00000638,13-07-2024,56:17.3,mustard,Bihar,kharif,179.59,4727.69,849039.96,B,retailer,BUYER-00483,delivered,paid,2024-07-13T10:56:17.336399
ORD-00000639,14-07-2024,56:17.3,groundnut,Andhra Pradesh,kharif,217.72,5171.35,1125919.75,B,exporter,BUYER-00455,completed,paid,2024-07-14T10:56:17.336399
ORD-00000640,14-07-2024,56:17.3,sesame,Punjab,kharif,367.96,7025.14,2584989.22,C,retailer,BUYER-00510,pending,pending,2024-07-14T10:56:17.336399
ORD-00000641,14-07-2024,56:17.3,mustard,Gujarat,kharif,80.93,4272.68,345790.16,C,exporter,BUYER-00405,completed,paid,2024-07-14T10:56:17.336399
ORD-00000642,14-07-2024,56:17.3,sunflower,Gujarat,kharif,105.55,3526.19,372174.04,A,exporter,BUYER-00650,completed,partial,2024-07-14T10:56:17.336399
ORD-00000643,15-07-2024,56:17.3,sesame,Karnataka,kharif,98.3,6568.85,645688.49,C,processor,BUYER-00065,delivered,partial,2024-07-15T10:56:17.336399
ORD-00000644,15-07-2024,56:17.3,sunflower,Uttar Pradesh,kharif,215.91,4181.11,902763.45,C,exporter,BUYER-00493,delivered,partial,2024-07-15T10:56:17.336399
ORD-00000645,15-07-2024,56:17.3,sesame,Telangana,kharif,484.25,7088,3432375.18,B,trader,BUYER-00173,completed,paid,2024-07-15T10:56:17.336399
ORD-00000646,15-07-2024,56:17.3,sunflower,Punjab,kharif,109.59,3653.41,400372.91,A,processor,BUYER-00497,delivered,paid,2024-07-15T10:56:17.336399
ORD-00000647,16-07-2024,56:17.3,mustard,Haryana,kharif,133.6,5295.87,707511.03,B,retailer,BUYER-00183,completed,paid,2024-07-16T10:56:17.336399
ORD-00000648,16-07-2024,56:17.3,groundnut,Bihar,kharif,89.98,4618.43,415550.66,A,trader,BUYER-00546,pending,partial,2024-07-16T10:56:17.336399
ORD-00000649,16-07-2024,56:17.3,soybean,Karnataka,kharif,219.64,4820.43,1058743.63,C,exporter,BUYER-00744,delivered,paid,2024-07-16T10:56:17.336399
ORD-00000650,16-07-2024,56:17.3,groundnut,Karnataka,kharif,265.48,5377.97,1427729.45,C,trader,BUYER-00925,pending,partial,2024-07-16T10:56:17.336399
ORD-00000651,17-07-2024,56:17.3,sunflower,Punjab,kharif,358.9,4320.09,1550473.9,A,trader,BUYER-00625,pending,partial,2024-07-17T10:56:17.336399
ORD-00000652,17-07-2024,56:17.3,groundnut,Punjab,kharif,506.78,5647.57,2862047.17,A,exporter,BUYER-00393,pending,pending,2024-07-17T10:56:17.336399
ORD-00000653,17-07-2024,56:17.3,groundnut,Uttar Pradesh,kharif,523.6,5681.86,2975012.49,A,processor,BUYER-00560,completed,paid,2024-07-17T10:56:17.336399
ORD-00000654,18-07-2024,56:17.3,sesame,Karnataka,kharif,231.94,7339.12,1702268.37,A,exporter,BUYER-00956,completed,pending,2024-07-18T10:56:17.336399
ORD-00000655,18-07-2024,56:17.3,sesame,Karnataka,kharif,530.02,7134.01,3781132.79,A,trader,BUYER-00759,pending,paid,2024-07-18T10:56:17.336399
ORD-00000656,19-07-2024,56:17.3,sunflower,Maharashtra,kharif,419.06,3743.14,1568602.23,A,retailer,BUYER-00945,pending,partial,2024-07-19T10:56:17.336399
ORD-00000657,19-07-2024,56:17.3,groundnut,Madhya Pradesh,kharif,250.58,4523.98,1133597.6,C,trader,BUYER-00856,completed,pending,2024-07-19T10:56:17.336399
ORD-00000658,19-07-2024,56:17.3,mustard,Punjab,kharif,295.09,4232.2,1248881.41,A,trader,BUYER-00940,delivered,pending,2024-07-19T10:56:17.336399
ORD-00000659,20-07-2024,56:17.3,groundnut,Rajasthan,kharif,175.63,4494.62,789384.54,C,exporter,BUYER-00200,pending,pending,2024-07-20T10:56:17.336399
ORD-00000660,20-07-2024,56:17.3,sunflower,Rajasthan,kharif,93.09,4046.61,376711.61,C,trader,BUYER-00621,completed,partial,2024-07-20T10:56:17.336399
ORD-00000661,21-07-2024,56:17.3,sesame,Rajasthan,kharif,99.3,5548.61,550973.18,B,trader,BUYER-00645,pending,partial,2024-07-21T10:56:17.336399
ORD-00000662,21-07-2024,56:17.3,sunflower,Rajasthan,kharif,441.72,3671.86,1621916.17,A,processor,BUYER-00927,pending,partial,2024-07-21T10:56:17.336399
ORD-00000663,21-07-2024,56:17.3,mustard,Punjab,kharif,121.07,4583.57,554938.03,A,retailer,BUYER-00399,pending,pending,2024-07-21T10:56:17.336399
ORD-00000664,21-07-2024,56:17.3,sesame,Karnataka,kharif,417.16,7053.49,2942413.33,C,processor,BUYER-00563,delivered,paid,2024-07-21T10:56:17.336399
ORD-00000665,22-07-2024,56:17.3,sunflower,Odisha,kharif,288.2,3856.56,1111467.87,A,retailer,BUYER-00352,delivered,pending,2024-07-22T10:56:17.336399
ORD-00000666,22-07-2024,56:17.3,groundnut,Bihar,kharif,62.15,5081.9,315825.82,A,trader,BUYER-00623,delivered,paid,2024-07-22T10:56:17.336399
ORD-00000667,22-07-2024,56:17.3,sunflower,Karnataka,kharif,125.25,4333.36,542741.44,A,processor,BUYER-00223,delivered,pending,2024-07-22T10:56:17.336399
ORD-00000668,22-07-2024,56:17.3,soybean,Odisha,kharif,574.22,4132.59,2373034.15,A,processor,BUYER-00329,delivered,pending,2024-07-22T10:56:17.336399
ORD-00000669,23-07-2024,56:17.3,mustard,Rajasthan,kharif,192.67,4095.02,788983.53,B,exporter,BUYER-00804,delivered,pending,2024-07-23T10:56:17.336399
ORD-00000670,23-07-2024,56:17.3,sesame,Gujarat,kharif,539.15,7035.54,3793188.96,A,exporter,BUYER-00169,pending,partial,2024-07-23T10:56:17.336399
ORD-00000671,23-07-2024,56:17.3,groundnut,Rajasthan,kharif,424.09,5166.08,2190888.85,B,processor,BUYER-00767,completed,pending,2024-07-23T10:56:17.336399
ORD-00000672,24-07-2024,56:17.3,soybean,Telangana,kharif,245.7,3994.07,981326.63,B,processor,BUYER-00859,completed,pending,2024-07-24T10:56:17.336399
ORD-00000673,24-07-2024,56:17.3,groundnut,Gujarat,kharif,589.18,5358.94,3157398.81,A,processor,BUYER-00693,pending,paid,2024-07-24T10:56:17.336399
ORD-00000674,24-07-2024,56:17.3,sunflower,Punjab,kharif,490.13,3823.68,1874079.89,C,exporter,BUYER-00288,pending,paid,2024-07-24T10:56:17.336399
ORD-00000675,25-07-2024,56:17.3,mustard,Bihar,kharif,51.67,4567.11,235976.3,A,exporter,BUYER-00936,completed,paid,2024-07-25T10:56:17.336399
ORD-00000676,25-07-2024,56:17.3,soybean,Telangana,kharif,482.84,3953.27,1908798.35,A,retailer,BUYER-00488,delivered,partial,2024-07-25T10:56:17.336399
ORD-00000677,25-07-2024,56:17.3,sesame,Odisha,kharif,182.84,6381.84,1166836.93,C,trader,BUYER-00985,pending,pending,2024-07-25T10:56:17.336399
ORD-00000678,26-07-2024,56:17.3,sunflower,Karnataka,kharif,683.11,3504.39,2393894.66,A,processor,BUYER-00725,delivered,partial,2024-07-26T10:56:17.336399
